HITId,AssignmentId,startphrase,ending1,ending2,labels,valid,qid
3M93N4X8HKX4K0PCAPGQYX1O9CGJSE,3QY5DC2MXSU7HVTE66P7MKN8ZKTFUE,The parking lot is an abandoned stadium.,The parking lot is full.,The parking lot is empty.,1,1,745
3M93N4X8HKX4K0PCAPGQYX1O9CGJSE,3QY5DC2MXSU7HVTE66P7MKN8ZKTFUE,The movie theater is a mall.,The movie theater is full.,The movie theater is empty.,0,1,746
3M93N4X8HKX4K0PCAPGQYX1O9CGJSE,3QY5DC2MXSU7HVTE66P7MKN8ZKTFUE,The movie theater is an abandoned hotel.,The movie theater is full.,The movie theater is empty.,1,1,746
3M93N4X8HKX4K0PCAPGQYX1O9CGJSE,3X4MXAO0BHYHCPNSS142LXMONRORWZ,The steak has the texture of a diamond,The steak is hard,The steak is soft,0,1,747
3M93N4X8HKX4K0PCAPGQYX1O9CGJSE,3X4MXAO0BHYHCPNSS142LXMONRORWZ,The steak has the texture of silk,The steak is hard,The steak is soft,1,1,747
3M93N4X8HKX4K0PCAPGQYX1O9CGJSE,3OUYGIZWR883SM6SM27S97D5L170PU,The houses are selling like Popeyes spicy chicken sandwich,Yh he houses are selling quickly,The houses are selling slowly because the conditions are bad.,0,1,751
3M93N4X8HKX4K0PCAPGQYX1O9CGJSE,3OUYGIZWR883SM6SM27S97D5L170PU,The houses are selling like snow cones on a snowy day.,Yh he houses are selling quickly,The houses are selling slowly because the conditions are bad.,1,1,751
3IZPORCT1FJWSFU970D0WAGDAITRHT,3KRVW3HTZOVX8STR3OYK29PTBNJSMF,My puppy has the energy of an octogenarian librarian,My puppy doesn't have a lot of energy,My puppy has a lot of energy,0,1,759
3IZPORCT1FJWSFU970D0WAGDAITRHT,3KRVW3HTZOVX8STR3OYK29PTBNJSMF,My puppy has the energy of an all night rave,My puppy doesn't have a lot of energy,My puppy has a lot of energy,1,1,759
3IZPORCT1FJWSFU970D0WAGDAITRHT,3KRVW3HTZOVX8STR3OYK29PTBNJSMF,I found her to be as interesting as eating oatmeal,She was not interesting,She was very interesting,0,1,760
3IZPORCT1FJWSFU970D0WAGDAITRHT,3KRVW3HTZOVX8STR3OYK29PTBNJSMF,I found her to be as interesting as a naked lady in a basket weaving contest,She was not interesting,She was very interesting,1,1,760
3IZPORCT1FJWSFU970D0WAGDAITRHT,3KRVW3HTZOVX8STR3OYK29PTBNJSMF,Those peppers I ate were as hot as satan's toenails,The peppers were extremely hot,The peppers were not hot at all,0,1,761
3IZPORCT1FJWSFU970D0WAGDAITRHT,3KRVW3HTZOVX8STR3OYK29PTBNJSMF,Those peppers I ate were as hot as an old sock,The peppers were extremely hot,The peppers were not hot at all,1,1,761
3IZPORCT1FJWSFU970D0WAGDAITRHT,3NG53N1RLWTLABBVH6K72MJN4ZVP8I,The students thought the assignment was like reading a pop magazine,The assignment was enaging.,The assignment was dry.,0,1,762
3IZPORCT1FJWSFU970D0WAGDAITRHT,3NG53N1RLWTLABBVH6K72MJN4ZVP8I,The students thought the assignment was like reading a dictionary,The assignment was enaging.,The assignment was dry.,1,1,762
3IZPORCT1FJWSFU970D0WAGDAITRHT,30X31N5D640W6RK26L8FTIUTH76SA9,The student has a brain of a fruit fly,The student is dumb.,The student is smart.,0,1,765
3IZPORCT1FJWSFU970D0WAGDAITRHT,30X31N5D640W6RK26L8FTIUTH76SA9,The student has a brain of a sperm whale.,The student is dumb.,The student is smart.,1,1,765
3IZPORCT1FJWSFU970D0WAGDAITRHT,30X31N5D640W6RK26L8FTIUTH76SA9,The wife has the appearance of an evil witch.,The wife is ugly.,The wife is beautiful.,0,1,766
3IZPORCT1FJWSFU970D0WAGDAITRHT,30X31N5D640W6RK26L8FTIUTH76SA9,The wife has the appearance of a majestic queen.,The wife is ugly.,The wife is beautiful.,1,1,766
3IZPORCT1FJWSFU970D0WAGDAITRHT,3ZOTGHDK5JLL8VE3G4DXUDEY6OSSOQ,The mirror is a bed of rocks.,The mirror is bumpy.,The mirror is smooth.,0,1,770
3IZPORCT1FJWSFU970D0WAGDAITRHT,3ZOTGHDK5JLL8VE3G4DXUDEY6OSSOQ,The mirror is an ice rink.,The mirror is bumpy.,The mirror is smooth.,1,1,770
3IZPORCT1FJWSFU970D0WAGDAITRHT,3RJSC4XJ114ZZCO92NYEB18OUB505R,The truck has as much towing power as A rhinoceros,The truck is powerful,The truck is weak,0,1,775
3IZPORCT1FJWSFU970D0WAGDAITRHT,3RJSC4XJ114ZZCO92NYEB18OUB505R,The truck has as much towing power as A tricycle,The truck is powerful,The truck is weak,1,1,775
3IZPORCT1FJWSFU970D0WAGDAITRHT,3RJSC4XJ114ZZCO92NYEB18OUB505R,Camping in the woods is as much fun as traffic,Camping is stressful,Camping is relaxing,0,1,776
3IZPORCT1FJWSFU970D0WAGDAITRHT,3RJSC4XJ114ZZCO92NYEB18OUB505R,Camping in the woods is as much fun as Bubble wrap,Camping is stressful,Camping is relaxing,1,1,776
3IZPORCT1FJWSFU970D0WAGDAITRHT,3RJSC4XJ114ZZCO92NYEB18OUB505R,His head is as big as A planet,His head is large,His head is small,0,1,777
3IZPORCT1FJWSFU970D0WAGDAITRHT,3RJSC4XJ114ZZCO92NYEB18OUB505R,His head is as big as A push pin,His head is large,His head is small,1,1,777
3IZPORCT1FJWSFU970D0WAGDAITRHT,3OCHAWUVGPUAELFNCMRRM4EH18RKXX,He has the health of a race winning horse,His health is good,His health is poor,0,1,781
3IZPORCT1FJWSFU970D0WAGDAITRHT,3OCHAWUVGPUAELFNCMRRM4EH18RKXX,He has the health of a woolly mammoth,His health is good,His health is poor,1,1,781
3IZPORCT1FJWSFU970D0WAGDAITRHT,3OCHAWUVGPUAELFNCMRRM4EH18RKXX,The tree has the height of the Burj Khalifa,The tree is extremely tall,The tree is short,0,1,782
3IZPORCT1FJWSFU970D0WAGDAITRHT,3OCHAWUVGPUAELFNCMRRM4EH18RKXX,The tree has the height of a baby teacup poodle,The tree is extremely tall,The tree is short,1,1,782
3IZPORCT1FJWSFU970D0WAGDAITRHT,3OCHAWUVGPUAELFNCMRRM4EH18RKXX,The soda has the carbonation of a kid blowing into a cup with a straw,The soda has a lot of carbonation,The soda is flat,0,1,783
3IZPORCT1FJWSFU970D0WAGDAITRHT,3OCHAWUVGPUAELFNCMRRM4EH18RKXX,The soda has the carbonation of a crepe dinner,The soda has a lot of carbonation,The soda is flat,1,1,783
3JU8CV4BRLML8J0HYL41BODZLMJOPM,3YOH7BII0AHIAWASC7Q9YJHWLMKVKK,Her fingernails were brittle like stale bread,Her fingernails were brittle,Her fingernails were not brittle,0,1,784
3JU8CV4BRLML8J0HYL41BODZLMJOPM,3YOH7BII0AHIAWASC7Q9YJHWLMKVKK,Her fingernails were brittle like diamonds,Her fingernails were brittle,Her fingernails were not brittle,1,1,784
3JU8CV4BRLML8J0HYL41BODZLMJOPM,3YOH7BII0AHIAWASC7Q9YJHWLMKVKK,His soul was a black hole,His soul was evil,His soul was good,0,1,786
3JU8CV4BRLML8J0HYL41BODZLMJOPM,3YOH7BII0AHIAWASC7Q9YJHWLMKVKK,His soul was heavenly,His soul was evil,His soul was good,1,1,786
3JU8CV4BRLML8J0HYL41BODZLMJOPM,3S4AW7T80CSU0P9VDB1N4TUYX3G4LA,She was a suitcase ready to be opened.,She was extroverted.,She was introverted.,0,1,788
3JU8CV4BRLML8J0HYL41BODZLMJOPM,3S4AW7T80CSU0P9VDB1N4TUYX3G4LA,She was a locked treasure chest.,She was extroverted.,She was introverted.,1,1,788
3JU8CV4BRLML8J0HYL41BODZLMJOPM,37C0GNLMHGDPH0PHJIWEIE67KLM6DJ,The book's message is as meaningful as a family heirloom,The book's message has profound meaning.,The book's message has no meaning.,0,1,790
3JU8CV4BRLML8J0HYL41BODZLMJOPM,37C0GNLMHGDPH0PHJIWEIE67KLM6DJ,The book's message is as meaningful as junkyard finds,The book's message has profound meaning.,The book's message has no meaning.,1,1,790
3JU8CV4BRLML8J0HYL41BODZLMJOPM,3ATPCQ38J9KT2DWB5R04B4IUY2LAY8,He can run like a fugitive.,He can run really fast.,He cannot run really fast.,0,1,796
3JU8CV4BRLML8J0HYL41BODZLMJOPM,3ATPCQ38J9KT2DWB5R04B4IUY2LAY8,He can run like an eighty-year old man.,He can run really fast.,He cannot run really fast.,1,1,796
3JU8CV4BRLML8J0HYL41BODZLMJOPM,3FTYUGLFSVVTYWP3EZM9Q8S7O175DK,My phone buzzes like a bee,My phone is busy.,My phone is quiet.,0,1,801
3JU8CV4BRLML8J0HYL41BODZLMJOPM,3FTYUGLFSVVTYWP3EZM9Q8S7O175DK,My phone buzzes like a statue,My phone is busy.,My phone is quiet.,1,1,801
3JU8CV4BRLML8J0HYL41BODZLMJOPM,3WAKVUDHUXQU22E8ONRVYSAR1WHU7W,The stick had the brittleness of the bones of an 80 year old woman who never drank milk,The stick is very brittle,The stick is strong,0,1,805
3JU8CV4BRLML8J0HYL41BODZLMJOPM,3WAKVUDHUXQU22E8ONRVYSAR1WHU7W,The stick had the brittleness of the diamonds core of an exotic star,The stick is very brittle,The stick is strong,1,1,805
3UUSLRKAULD5YG5SCQW408AFHE67D1,3Q5C1WP23NBZ619RY62EP6RYZTF15F,Her perfume lingered like a mangy dog,Her perfume lingered heavily and smelled bad.,Her perfume lingered lightly and smelled good.,0,1,812
3UUSLRKAULD5YG5SCQW408AFHE67D1,3Q5C1WP23NBZ619RY62EP6RYZTF15F,Her perfume lingered like a fairy,Her perfume lingered heavily and smelled bad.,Her perfume lingered lightly and smelled good.,1,1,812
3UUSLRKAULD5YG5SCQW408AFHE67D1,3PZDLQMM0UVRU702WKP08V7DJGM2CC,That old machine is as useful as an udder on a bull,The machine is useless,The machine does a great job,0,1,816
3UUSLRKAULD5YG5SCQW408AFHE67D1,3PZDLQMM0UVRU702WKP08V7DJGM2CC,That old machine is as useful as new machines,The machine is useless,The machine does a great job,1,1,816
3UUSLRKAULD5YG5SCQW408AFHE67D1,33L7PJKHCH8J2342YNTR7WKKT3H8T9,He had the depth of a bathtub,He was shallow.,He was deep.,0,1,817
3UUSLRKAULD5YG5SCQW408AFHE67D1,33L7PJKHCH8J2342YNTR7WKKT3H8T9,He had the depth of the sea,He was shallow.,He was deep.,1,1,817
3UUSLRKAULD5YG5SCQW408AFHE67D1,33L7PJKHCH8J2342YNTR7WKKT3H8T9,The sky was a piece of onyx,The night sky was black.,The sky was white.,0,1,818
3UUSLRKAULD5YG5SCQW408AFHE67D1,33L7PJKHCH8J2342YNTR7WKKT3H8T9,The sky was an opal,The night sky was black.,The sky was white.,1,1,818
3UUSLRKAULD5YG5SCQW408AFHE67D1,30X31N5D640W6RK26L8FTIUTH6XSAY,The movie was as funny as a book of knock-knock jokes,The movie wasn't really funny.,The movie was hilarious.,0,1,821
3UUSLRKAULD5YG5SCQW408AFHE67D1,30X31N5D640W6RK26L8FTIUTH6XSAY,The movie was as funny as a standup comedy show,The movie wasn't really funny.,The movie was hilarious.,1,1,821
3UUSLRKAULD5YG5SCQW408AFHE67D1,3WZ36BJEV4Q241291ZD1YYAL1IQTBZ,The fence has the rust of an old nail,The fence is very rusty,The fence is not rusty,0,1,824
3UUSLRKAULD5YG5SCQW408AFHE67D1,3WZ36BJEV4Q241291ZD1YYAL1IQTBZ,The fence has the rust of a diamond,The fence is very rusty,The fence is not rusty,1,1,824
3UUSLRKAULD5YG5SCQW408AFHE67D1,37M28K1J0RN37O1CJRZ11H36LYCAJE,She's as cultured as champagne.,She is very cultured.,She isn't cultured at all.,0,1,827
3UUSLRKAULD5YG5SCQW408AFHE67D1,37M28K1J0RN37O1CJRZ11H36LYCAJE,She's as cultured as a bud-light.,She is very cultured.,She isn't cultured at all.,1,1,827
3UUSLRKAULD5YG5SCQW408AFHE67D1,37M28K1J0RN37O1CJRZ11H36LYCAJE,Her tastes are more Ferrari than backyard junker.,Her tastes are extremely expensive.,Her tastes are cheap.,0,1,828
3UUSLRKAULD5YG5SCQW408AFHE67D1,37M28K1J0RN37O1CJRZ11H36LYCAJE,Her tastes are more backyard junker than Ferrari.,Her tastes are extremely expensive.,Her tastes are cheap.,1,1,828
3TZDZ3Y0JSGFK4D9BUATD20CN7R91P,39N5ACM9HFXLOGU5MYQL2IEYO459PH,The quarterback was throwing straight surface-to-air missiles.,He throws far,He can't throw very well,0,1,835
3TZDZ3Y0JSGFK4D9BUATD20CN7R91P,39N5ACM9HFXLOGU5MYQL2IEYO459PH,The quarterback was throwing straight duds,He throws far,He can't throw very well,1,1,835
3TZDZ3Y0JSGFK4D9BUATD20CN7R91P,39N5ACM9HFXLOGU5MYQL2IEYO459PH,His argument was like a shadow,his argument had no substance,his argument was felt,0,1,836
3TZDZ3Y0JSGFK4D9BUATD20CN7R91P,39N5ACM9HFXLOGU5MYQL2IEYO459PH,His argument was like a chiropractor,his argument had no substance,his argument was felt,1,1,836
3TZDZ3Y0JSGFK4D9BUATD20CN7R91P,39N5ACM9HFXLOGU5MYQL2IEYO459PH,The day was like a news clip,the day went by fast,the day was really long,0,1,837
3TZDZ3Y0JSGFK4D9BUATD20CN7R91P,39N5ACM9HFXLOGU5MYQL2IEYO459PH,The day was like the Pan-American Highway,the day went by fast,the day was really long,1,1,837
3TZDZ3Y0JSGFK4D9BUATD20CN7R91P,3WLEIWSYHPRIBFBIIC31JM4TW80H29,The meeting was as solemn as Sunday morning Mass.,The meeting had a tone of seriousness.,The meeting had a tone of unseriousness.,0,1,838
3TZDZ3Y0JSGFK4D9BUATD20CN7R91P,3WLEIWSYHPRIBFBIIC31JM4TW80H29,The meeting was as solemn as a college football game.,The meeting had a tone of seriousness.,The meeting had a tone of unseriousness.,1,1,838
3TZDZ3Y0JSGFK4D9BUATD20CN7R91P,3WLEIWSYHPRIBFBIIC31JM4TW80H29,The restaurant experience was like a stately dinner.,The restaurant experience was upper-class.,The restaurant experience was homely and down-to-earth.,0,1,839
3TZDZ3Y0JSGFK4D9BUATD20CN7R91P,3WLEIWSYHPRIBFBIIC31JM4TW80H29,The restaurant experience was like a dinner at grandma's on the weekend.,The restaurant experience was upper-class.,The restaurant experience was homely and down-to-earth.,1,1,839
3TZDZ3Y0JSGFK4D9BUATD20CN7R91P,3WLEIWSYHPRIBFBIIC31JM4TW80H29,The lawyer was as humble as Icarus.,The lawyer was showy and greatly believed in himself beyond reason.,The lawyer was unassuming and had a gentle disposition.,0,1,840
3TZDZ3Y0JSGFK4D9BUATD20CN7R91P,3WLEIWSYHPRIBFBIIC31JM4TW80H29,The lawyer was as humble as an ancient monk.,The lawyer was showy and greatly believed in himself beyond reason.,The lawyer was unassuming and had a gentle disposition.,1,1,840
3TZDZ3Y0JSGFK4D9BUATD20CN7R91P,358010RM5F3OUW9ZBQ5YODPYHWHXVV,The bike tires have the sturdiness of a vanilla wafer.,The bike tires are flimsy.,The bike tires are well built.,0,1,842
3TZDZ3Y0JSGFK4D9BUATD20CN7R91P,358010RM5F3OUW9ZBQ5YODPYHWHXVV,The bike tires have the sturdiness of Atlas.,The bike tires are flimsy.,The bike tires are well built.,1,1,842
3TZDZ3Y0JSGFK4D9BUATD20CN7R91P,3VZLGYJEYMK53GE9CNU19J2U571XZ9,The lake is a wave pool.,The lake is choppy.,The lake is calm.,0,1,844
3TZDZ3Y0JSGFK4D9BUATD20CN7R91P,3VZLGYJEYMK53GE9CNU19J2U571XZ9,The lake is a sheet of glass.,The lake is choppy.,The lake is calm.,1,1,844
3TZDZ3Y0JSGFK4D9BUATD20CN7R91P,3VZLGYJEYMK53GE9CNU19J2U571XZ9,The ocean is a sheet of ice.,The ocean is smooth.,The ocean is choppy.,0,1,845
3TZDZ3Y0JSGFK4D9BUATD20CN7R91P,3VZLGYJEYMK53GE9CNU19J2U571XZ9,The ocean is a bed of rocks.,The ocean is smooth.,The ocean is choppy.,1,1,845
3TZDZ3Y0JSGFK4D9BUATD20CN7R91P,3VZLGYJEYMK53GE9CNU19J2U571XZ9,The TV show has the depth of a toilet.,The TV show is shallow.,The TV show is cerebral.,0,1,846
3TZDZ3Y0JSGFK4D9BUATD20CN7R91P,3VZLGYJEYMK53GE9CNU19J2U571XZ9,The TV show has the depth of the dead sea.,The TV show is shallow.,The TV show is cerebral.,1,1,846
3TZDZ3Y0JSGFK4D9BUATD20CN7R91P,386CSBG1O0WJ69TMO42YIDD630FQ6C,She was as flaky as wood shavings,She was extremely flaky.,She wasn't flaky at all.,0,1,848
3TZDZ3Y0JSGFK4D9BUATD20CN7R91P,386CSBG1O0WJ69TMO42YIDD630FQ6C,She was as flaky as steel,She was extremely flaky.,She wasn't flaky at all.,1,1,848
3TZDZ3Y0JSGFK4D9BUATD20CN7R91P,3COPXFW7XCM55CDWQVHASRSEZZNPKZ,The book is an complex as the night sky,The book is very complicated.,The book is easy to understand.,0,1,849
3TZDZ3Y0JSGFK4D9BUATD20CN7R91P,3COPXFW7XCM55CDWQVHASRSEZZNPKZ,The book is an complex as a children's puzzle,The book is very complicated.,The book is easy to understand.,1,1,849
3TZDZ3Y0JSGFK4D9BUATD20CN7R91P,35GCEFQ6I6YTNI7VSYND23DQYFV3ZG,Driving in this fog was like moving in quicksand,the fog was thick,the fog was thin,0,1,853
3TZDZ3Y0JSGFK4D9BUATD20CN7R91P,35GCEFQ6I6YTNI7VSYND23DQYFV3ZG,Driving in this fog was like a photon travelling in empty space,the fog was thick,the fog was thin,1,1,853
3TZDZ3Y0JSGFK4D9BUATD20CN7R91P,35GCEFQ6I6YTNI7VSYND23DQYFV3ZG,"When she hustles, she looks like a transformer",she hustles cumbersomely,she hustles gracefully,0,1,854
3TZDZ3Y0JSGFK4D9BUATD20CN7R91P,35GCEFQ6I6YTNI7VSYND23DQYFV3ZG,"When she hustles, she looks like a gazelle",she hustles cumbersomely,she hustles gracefully,1,1,854
3TZDZ3Y0JSGFK4D9BUATD20CN7R91P,3T3IWE1XG7XP874YKHARTN5KNIOQT5,He's as transparent as a window.,He is easy to read.,He is not easy to read.,0,1,856
3TZDZ3Y0JSGFK4D9BUATD20CN7R91P,3T3IWE1XG7XP874YKHARTN5KNIOQT5,He's as transparent as a sandstorm.,He is easy to read.,He is not easy to read.,1,1,856
3TZDZ3Y0JSGFK4D9BUATD20CN7R91P,3T3IWE1XG7XP874YKHARTN5KNIOQT5,That movie was as long as a prison sentence.,The movie was really long.,The movie was really short.,0,1,857
3TZDZ3Y0JSGFK4D9BUATD20CN7R91P,3T3IWE1XG7XP874YKHARTN5KNIOQT5,That movie was as long as a fifty-yard dash.,The movie was really long.,The movie was really short.,1,1,857
3TZDZ3Y0JSGFK4D9BUATD20CN7R91P,358UUM7WR0D2MAMRKTWQTHN7UXRR73,The fog has the thickness of a heavy woman's thighs,The fog is thick,The fog is thin,0,1,858
3TZDZ3Y0JSGFK4D9BUATD20CN7R91P,358UUM7WR0D2MAMRKTWQTHN7UXRR73,The fog has the thickness of Christian Bale in The Machinist,The fog is thick,The fog is thin,1,1,858
3TZDZ3Y0JSGFK4D9BUATD20CN7R91P,358UUM7WR0D2MAMRKTWQTHN7UXRR73,The show has all the cancelations of The Simpsons,The show has never been canceled,The show has been canceled many times,0,1,859
3TZDZ3Y0JSGFK4D9BUATD20CN7R91P,358UUM7WR0D2MAMRKTWQTHN7UXRR73,The show has all the cancelations of Futurama,The show has never been canceled,The show has been canceled many times,1,1,859
356TQKY9XF7THL91VILOEGWE6N978V,3E1QT0TDFQJTTPOR4BUNTPIBIL38IS,Her emotional resilience was as sturdy as glass,She was not emotionally resilient at all.,She had a lot of emotional resilience.,0,1,861
356TQKY9XF7THL91VILOEGWE6N978V,3E1QT0TDFQJTTPOR4BUNTPIBIL38IS,Her emotional resilience was as sturdy as spider silk,She was not emotionally resilient at all.,She had a lot of emotional resilience.,1,1,861
356TQKY9XF7THL91VILOEGWE6N978V,304SM51WA4E1P1PUCZ8BOTEZZPYBSU,Her poem is a business contract.,Her poem is boring.,Her poem is exciting.,0,1,865
356TQKY9XF7THL91VILOEGWE6N978V,304SM51WA4E1P1PUCZ8BOTEZZPYBSU,Her poem is a literal manifesto.,Her poem is boring.,Her poem is exciting.,1,1,865
356TQKY9XF7THL91VILOEGWE6N978V,3NPFYT4IZDE5CZJ4MV6COCMOUJEXGV,This computer moves like an obese person in an electric scooter,the computer is slow,the computer is very fast,0,1,867
356TQKY9XF7THL91VILOEGWE6N978V,3NPFYT4IZDE5CZJ4MV6COCMOUJEXGV,This computer moves like a race car,the computer is slow,the computer is very fast,1,1,867
356TQKY9XF7THL91VILOEGWE6N978V,3B4YI393VA606N6WNLU6EIOZ3LMSSU,The mother has the kindness of Santa's wife,The mother is giving,The mother is mean,0,1,872
356TQKY9XF7THL91VILOEGWE6N978V,3B4YI393VA606N6WNLU6EIOZ3LMSSU,The mother has the kindness of a praying Mantis,The mother is giving,The mother is mean,1,1,872
356TQKY9XF7THL91VILOEGWE6N978V,3B4YI393VA606N6WNLU6EIOZ3LMSSU,The student has the insight of a librarian,The student is smart,The student is unwise,0,1,873
356TQKY9XF7THL91VILOEGWE6N978V,3B4YI393VA606N6WNLU6EIOZ3LMSSU,The student has the insight of a goose,The student is smart,The student is unwise,1,1,873
356TQKY9XF7THL91VILOEGWE6N978V,3YMTUJH0DTQIJ2H0MK3EQK4FRQ6T4Q,That thing is as valuable as Jeff Bezos's bank account.,The item is extremely valuable.,The item is not valuable at all.,0,1,876
356TQKY9XF7THL91VILOEGWE6N978V,3YMTUJH0DTQIJ2H0MK3EQK4FRQ6T4Q,That thing is as valuable as an empty beer can.,The item is extremely valuable.,The item is not valuable at all.,1,1,876
356TQKY9XF7THL91VILOEGWE6N978V,3WYGZ5XF3XP2I4TOICL4NWXPMTPKSP,Her boss is a grizzly,Her boss is aggressive and mean,Her boss is docile,0,1,879
356TQKY9XF7THL91VILOEGWE6N978V,3WYGZ5XF3XP2I4TOICL4NWXPMTPKSP,Her boss is a goldfish,Her boss is aggressive and mean,Her boss is docile,1,1,879
356TQKY9XF7THL91VILOEGWE6N978V,3UOUJI6MTEOOHHKZ60VTSRNF3Q1XU1,His position on the platform was like A jenga tower.,His position was not stable.,His position was firm.,0,1,880
356TQKY9XF7THL91VILOEGWE6N978V,3UOUJI6MTEOOHHKZ60VTSRNF3Q1XU1,His position on the platform was like A house with a stable platform.,His position was not stable.,His position was firm.,1,1,880
356TQKY9XF7THL91VILOEGWE6N978V,3GM6G9ZBKO7YNS66SO3ACELFD75TMF,"The gorilla has the strength of a giant, mutant ant",The gorilla is strong,The gorilla is weak,0,1,884
356TQKY9XF7THL91VILOEGWE6N978V,3GM6G9ZBKO7YNS66SO3ACELFD75TMF,"The gorilla has the strength of a sick, old man",The gorilla is strong,The gorilla is weak,1,1,884
38EHZ67RIM2RV3M6IMZ1PBA2PVHGMV,3Z2R0DQ0JIO6R5KGSBVVYJ7G4SHE2Z,His feet were as big as a basketball player's.,His feet were very big.,His feet were small.,0,1,887
38EHZ67RIM2RV3M6IMZ1PBA2PVHGMV,3Z2R0DQ0JIO6R5KGSBVVYJ7G4SHE2Z,His feet were as big as an adolescent child.,His feet were very big.,His feet were small.,1,1,887
38EHZ67RIM2RV3M6IMZ1PBA2PVHGMV,3Z2R0DQ0JIO6R5KGSBVVYJ7G4SHE2Z,The gift I received was as welcomed as blessing from God.,The gift was well-received and deemed beneficial to the receiver.,The gift was not well-received or deemed beneficial to the receiver.,0,1,888
38EHZ67RIM2RV3M6IMZ1PBA2PVHGMV,3Z2R0DQ0JIO6R5KGSBVVYJ7G4SHE2Z,The gift I received was as welcomed as curse from Satan.,The gift was well-received and deemed beneficial to the receiver.,The gift was not well-received or deemed beneficial to the receiver.,1,1,888
38EHZ67RIM2RV3M6IMZ1PBA2PVHGMV,3VP0C6EFSH6SLUVUWBVH14T1TZQ6MD,The man was as ambitious as an astrophysicist,The man set ambitious goals for himself.,The man lacked ambition.,0,1,891
38EHZ67RIM2RV3M6IMZ1PBA2PVHGMV,3VP0C6EFSH6SLUVUWBVH14T1TZQ6MD,The man was as ambitious as a custodian,The man set ambitious goals for himself.,The man lacked ambition.,1,1,891
38EHZ67RIM2RV3M6IMZ1PBA2PVHGMV,39O5D9O87U2GFPWL0K35R5C5PVP3CT,The marriage is as good as a fresh out of the oven bagel,They have an awesome marriage,Their marriage is horrible,0,1,894
38EHZ67RIM2RV3M6IMZ1PBA2PVHGMV,39O5D9O87U2GFPWL0K35R5C5PVP3CT,The marriage is as good as a month old banana,They have an awesome marriage,Their marriage is horrible,1,1,894
38EHZ67RIM2RV3M6IMZ1PBA2PVHGMV,3GD6L00D3T7XE8UXQ5J0682KLPPM1C,His mother's voice seemed a splinter,His mother's voice was annoying/agitating.,His mother's voice was soothing/calming.,0,1,895
38EHZ67RIM2RV3M6IMZ1PBA2PVHGMV,3GD6L00D3T7XE8UXQ5J0682KLPPM1C,His mother's voice seemed a salve,His mother's voice was annoying/agitating.,His mother's voice was soothing/calming.,1,1,895
38EHZ67RIM2RV3M6IMZ1PBA2PVHGMV,3PMBY0YE28D2URL1HT4FIIFRPWOC9Q,The book was as exciting as Noam Chomsky on qualudes,The book was boring,The book was gripping,0,1,900
38EHZ67RIM2RV3M6IMZ1PBA2PVHGMV,3PMBY0YE28D2URL1HT4FIIFRPWOC9Q,The book was as exciting as winning the lottery the day you first got laid,The book was boring,The book was gripping,1,1,900
38EHZ67RIM2RV3M6IMZ1PBA2PVHGMV,3RXCAC0YISZFXYIWENUK8D5V3I1G8I,The preschool teacher was a grim reaper.,The preschool teacher was dour.,The preschool teacher was funny.,0,1,901
38EHZ67RIM2RV3M6IMZ1PBA2PVHGMV,3RXCAC0YISZFXYIWENUK8D5V3I1G8I,The preschool teacher was a clown.,The preschool teacher was dour.,The preschool teacher was funny.,1,1,901
38EHZ67RIM2RV3M6IMZ1PBA2PVHGMV,3RXCAC0YISZFXYIWENUK8D5V3I1G8I,The chemist was a lumberjack.,The chemist was sloppy.,The chemist was careful.,0,1,902
38EHZ67RIM2RV3M6IMZ1PBA2PVHGMV,3RXCAC0YISZFXYIWENUK8D5V3I1G8I,The chemist was an artist.,The chemist was sloppy.,The chemist was careful.,1,1,902
38EHZ67RIM2RV3M6IMZ1PBA2PVHGMV,3YWRV122CT9Y2GJRYSJ1CS6MCQI8UC,I could devour that book as if it was a slice of my favorite pizza,The book is interesting,The book is dull,0,1,905
38EHZ67RIM2RV3M6IMZ1PBA2PVHGMV,3YWRV122CT9Y2GJRYSJ1CS6MCQI8UC,I could devour that book as if it was a shoe sole,The book is interesting,The book is dull,1,1,905
38EHZ67RIM2RV3M6IMZ1PBA2PVHGMV,3IAS3U3I0GQ8K28WIKT5XB1V15BB2N,This novel reads like poetry.,The book has beautiful language.,The book is really boring writing.,0,1,907
38EHZ67RIM2RV3M6IMZ1PBA2PVHGMV,3IAS3U3I0GQ8K28WIKT5XB1V15BB2N,This novel reads like a shopping list.,The book has beautiful language.,The book is really boring writing.,1,1,907
38EHZ67RIM2RV3M6IMZ1PBA2PVHGMV,3IAS3U3I0GQ8K28WIKT5XB1V15BB2N,That man has skin made of titanium.,That man isn't very sensitive.,That man is very sensitive.,0,1,909
38EHZ67RIM2RV3M6IMZ1PBA2PVHGMV,3IAS3U3I0GQ8K28WIKT5XB1V15BB2N,That man has skin made of tissue paper.,That man isn't very sensitive.,That man is very sensitive.,1,1,909
3CRWSLD91KEFNG3465C9UKJ4GH8OMQ,3HMIGG0U4MGFJP3W8TGQFDCZ83O8YJ,That girl has the depth of a toilet,That girl is vain.,That girl is profound.,0,1,914
3CRWSLD91KEFNG3465C9UKJ4GH8OMQ,3HMIGG0U4MGFJP3W8TGQFDCZ83O8YJ,That girl has the depth of a diving pool.,That girl is vain.,That girl is profound.,1,1,914
3CRWSLD91KEFNG3465C9UKJ4GH8OMQ,3HMIGG0U4MGFJP3W8TGQFDCZ83O8YJ,The woman has the skin of a cat's tongue.,That woman has rough skin.,That woman has smooth skin.,0,1,915
3CRWSLD91KEFNG3465C9UKJ4GH8OMQ,3HMIGG0U4MGFJP3W8TGQFDCZ83O8YJ,The woman has the skin of mirror.,That woman has rough skin.,That woman has smooth skin.,1,1,915
3CRWSLD91KEFNG3465C9UKJ4GH8OMQ,3H7Z272LX8HGPIVEBVTB7R5TOYJPLR,The child's singing voice sounded like Madonna's,The child's singing voice was excellent.,The child's singing voice was poor.,0,1,917
3CRWSLD91KEFNG3465C9UKJ4GH8OMQ,3H7Z272LX8HGPIVEBVTB7R5TOYJPLR,The child's singing voice sounded like a scratchy violin,The child's singing voice was excellent.,The child's singing voice was poor.,1,1,917
3CRWSLD91KEFNG3465C9UKJ4GH8OMQ,3H7Z272LX8HGPIVEBVTB7R5TOYJPLR,He had as much money as a tent dweller,He had no money.,He had a lot of money.,0,1,918
3CRWSLD91KEFNG3465C9UKJ4GH8OMQ,3H7Z272LX8HGPIVEBVTB7R5TOYJPLR,He had as much money as a mansion dweller,He had no money.,He had a lot of money.,1,1,918
3CRWSLD91KEFNG3465C9UKJ4GH8OMQ,3IQ1VMJRYUUE1CO3XF8OCNP3PIBA98,The group were as collaborative as a bunch of monkeys,they didnt work well together,they worked well together,0,1,919
3CRWSLD91KEFNG3465C9UKJ4GH8OMQ,3IQ1VMJRYUUE1CO3XF8OCNP3PIBA98,The group were as collaborative as well oiled gears,they didnt work well together,they worked well together,1,1,919
3CRWSLD91KEFNG3465C9UKJ4GH8OMQ,3IQ1VMJRYUUE1CO3XF8OCNP3PIBA98,The display was bright as the sun,it was really bright,it was really dull,0,1,920
3CRWSLD91KEFNG3465C9UKJ4GH8OMQ,3IQ1VMJRYUUE1CO3XF8OCNP3PIBA98,The display was bright as a new moon,it was really bright,it was really dull,1,1,920
3CRWSLD91KEFNG3465C9UKJ4GH8OMQ,3IQ1VMJRYUUE1CO3XF8OCNP3PIBA98,The novel was as deep as a kiddie pool,it had no meaning,it had meaning,0,1,921
3CRWSLD91KEFNG3465C9UKJ4GH8OMQ,3IQ1VMJRYUUE1CO3XF8OCNP3PIBA98,The novel was as deep as the great sea,it had no meaning,it had meaning,1,1,921
3CRWSLD91KEFNG3465C9UKJ4GH8OMQ,3N1FSUEFL6AB2DL30U3ZLGMTOVC4DU,She had the swimming ability of a mermaid,She was a good swimmer,She was a bad swimmer,0,1,923
