startphrase,ending1,ending2,labels,valid,qid,index
Her word had the strength of titanium.,Her promises can be believed.,Her promises cannot be trusted.,0,1,10,
Her word had the strength of a wine glass.,Her promises can be believed.,Her promises cannot be trusted.,1,1,10,
His kisses have the passion of lovers meeting after a long separation.,His kisses are demonstrative and intense.,His kiss is unemotional.,0,1,11,
His kisses have the passion of a couple in a loveless marriage.,His kisses are demonstrative and intense.,His kiss is unemotional.,1,1,11,
This winter is as cold as my mother-in-law towards me,It's very cold,It's pretty warm,0,1,14,
This winter is as cold as Death Valley at noon,It's very cold,It's pretty warm,1,1,14,
The dog was as grumpy as an old man,he was mean,he was nice,0,1,22,
The dog was as grumpy as a kindergarten teacher,he was mean,he was nice,1,1,22,
The voyage was as long as a lifetime,The voyage was very long,The voyage as short.,0,1,24,
The voyage was as long as the blink of an eye,The voyage was very long,The voyage as short.,1,1,24,
He had all the wealth of a tycoon,He was rich.,He was poor.,0,1,26,
He had all the wealth of a hobo,He was rich.,He was poor.,1,1,26,
It smells like a freshly baked cookies on Christmas morning,It smells great,It smells awful,0,1,31,
It smells like a cesspool sitting in the hot sun,It smells great,It smells awful,1,1,31,
The conversation is a bank vault,The conversation is worthwhile.,The conversation is meaningless.,0,1,33,
The conversation is a 25 cent off coupon,The conversation is worthwhile.,The conversation is meaningless.,1,1,33,
The motivational push was a bulldozer,The motivational push was very motivating.,The motivational push didn't work well.,0,1,34,
The motivational push was a light breeze,The motivational push was very motivating.,The motivational push didn't work well.,1,1,34,
Money is a helpful stranger,Money is good,Money is bad,0,1,36,
Money is a murderer,Money is good,Money is bad,1,1,36,
The conversation was the OJ Simpson trial,The conversation was long,The conversation was short,0,1,37,
The conversation was a cigarette break,The conversation was long,The conversation was short,1,1,37,
The seas on the voyage were glass,The seas were calm,The seas were rough,0,1,38,
The seas on the voyage were a rock quarry,The seas were calm,The seas were rough,1,1,38,
The student was as helpful as medicine,he was a big help,he was not needed,0,1,40,
The student was as helpful as a punch in the face,he was a big help,he was not needed,1,1,40,
Their relationship has the heat of Miami in August,Their relationship is passionate,Their relationship is lacking passion.,0,1,42,
Their relationship has the heat of an igloo.,Their relationship is passionate,Their relationship is lacking passion.,1,1,42,
The voyage will be a walk through fire.,The voyage will be difficult and arduous.,The voyage will be pleasant.,0,1,46,
The voyage will be a walk through flowers.,The voyage will be difficult and arduous.,The voyage will be pleasant.,1,1,46,
"For him, earning money was oxygen.",Making money kept him alive.,Making money was killing him.,0,1,47,
"For him, earning money was a rope around his neck.",Making money kept him alive.,Making money was killing him.,1,1,47,
The speaker was as quiet as a newborn baby.,The speaker was very quiet.,The speaker was actually rather loud.,0,1,49,
The speaker was as quiet as a freight train.,The speaker was very quiet.,The speaker was actually rather loud.,1,1,49,
The man was as cool as ice,The man was very cool.,The man wasn't cool at all.,0,1,50,
The man was as cool as sunburn,The man was very cool.,The man wasn't cool at all.,1,1,50,
The wedding planner was an imposter.,The wedding planner did a horrible job planning the wedding.,The wedding planner did wonderfully planning the wedding.,0,1,51,
The wedding planner was a magician.,The wedding planner did a horrible job planning the wedding.,The wedding planner did wonderfully planning the wedding.,1,1,51,
The dancer moved like a butterfly,the dancer is graceful,The dancer is lead footed,0,1,54,
The dancer moved like a horse.,the dancer is graceful,The dancer is lead footed,1,1,54,
the pizza tastes like homemade,it's delicious,it's garbage,0,1,56,
the pizza tastes like yesterdays leftovers,it's delicious,it's garbage,1,1,56,
The painting had the creativity of a bowl of oatmeal,The movie was really dull.,The movie was really creative.,0,1,61,
The painting had the creativity of a James Cameron movie,The movie was really dull.,The movie was really creative.,1,1,61,
The child was as religious as a priest,The child was very religious,The child was not religious,0,1,63,
The child was as religious as a sinner,The child was very religious,The child was not religious,1,1,63,
The woman was as kind as a teacher,The woman was kind,The woman was cruel,0,1,64,
The woman was as kind as a prisoner,The woman was kind,The woman was cruel,1,1,64,
The test is as easy as a Sunday  morning,the test is easy,the test is hard,0,1,70,
The test is as easy as rocket science,the test is easy,the test is hard,1,1,70,
She is happy as a clam,she is elated,she is mad,0,1,71,
She is happy as a bear that stepped on a thorn,she is elated,she is mad,1,1,71,
The employee is sharp as a razor,The employee is smart.,The employee is dumb.,0,1,74,
The employee is sharp as a bowling ball,The employee is smart.,The employee is dumb.,1,1,74,
The tourist thought the bed at the hotel felt like velvet,The bed was soft.,The bed was hard.,0,1,76,
The tourist thought the bed at the hotel felt like marble,The bed was soft.,The bed was hard.,1,1,76,
When the rubber hits the road. life gets real,things get intense,things get worse,0,1,77,
When the rubber hits the road. things go  down hill,things get intense,things get worse,1,1,77,
The pianist's performance was a game of whack-a-mole.,The pianist's performance was sloppy.,The pianist's performance was meticulous.,0,1,79,
The pianist's performance was the weaving of an ornate Persian carpet.,The pianist's performance was sloppy.,The pianist's performance was meticulous.,1,1,79,
The girl's personality was as sweet as a grapefruit,The girl had a very surly personality.,The girl had a sweet personality.,0,1,82,
The girl's personality was as sweet as a donut,The girl had a very surly personality.,The girl had a sweet personality.,1,1,82,
The movie had as much meaning as a Hallmark card,The movie's meaning was frivolous.,The movie was laden with meaning.,0,1,83,
The movie had as much meaning as the Bible,The movie's meaning was frivolous.,The movie was laden with meaning.,1,1,83,
The jazz solo sounded as smooth as silk,The jazz solo sounded nice and smooth,The jazz solo sounded rough and bad,0,1,85,
The jazz solo sounded as smooth as sandpaper,The jazz solo sounded nice and smooth,The jazz solo sounded rough and bad,1,1,85,
Her hangover made her feel like death,Her hangover made her feel terrible.,Her hangover didn't hurt her at all.,0,1,87,
Her hangover made her feel like a sunrise,Her hangover made her feel terrible.,Her hangover didn't hurt her at all.,1,1,87,
The room was as open as a farm.,The room was very open.,The room wasn't open at all.,0,1,89,
The room was as open as a city.,The room was very open.,The room wasn't open at all.,1,1,89,
His joints have the crackle of a bowl of Rice Krispies,His joints are quite crackly,His joints do not crackle,0,1,92,
His joints have the crackle of a pre-popped roll of bubble wrap,His joints are quite crackly,His joints do not crackle,1,1,92,
The lightbulb is putting out the light of a massive forest fire on a dark night,The lightbulb is putting out a lot of light,The lightbulb is putting out no light,0,1,93,
The lightbulb is putting out the light of a massive black hole in the darkness of space,The lightbulb is putting out a lot of light,The lightbulb is putting out no light,1,1,93,
The thrift store had the variety of a monochrome print.,The thrift store had a limited selection.,The thrift store had a varied selection.,0,1,95,
The thrift store had the variety of a dazzling tapestry.,The thrift store had a limited selection.,The thrift store had a varied selection.,1,1,95,
The doctor was a Norse villain.,The doctor was mean.,The doctor was kind and charming.,0,1,96,
The doctor was a fairytale prince.,The doctor was mean.,The doctor was kind and charming.,1,1,96,
The sound of the glass shattering was like Hiroshima,The sound was loud,The sound was quiet,0,1,98,
The sound of the glass shattering was like a lullaby,The sound was loud,The sound was quiet,1,1,98,
She was a bear at dinner,She ate a lot,She ate very little,0,1,99,
She was a mouse at dinner,She ate a lot,She ate very little,1,1,99,
The armor was tough as iron,The armor was tough,The armor was breakable and weak,0,1,100,
The armor was tough as glass,The armor was tough,The armor was breakable and weak,1,1,100,
The toy was cared for like a baby,The toy was taken good care of,The toy was not cared for well at all.,0,1,102,
The toy was cared for like trash,The toy was taken good care of,The toy was not cared for well at all.,1,1,102,
The lawyer's negotiation tactics were like steel,The lawyer's negotiation tactics were tough.,The lawyer's negotiation tactics were lenient.,0,1,103,
The lawyer's negotiation tactics were like a fuzzy bathrobe,The lawyer's negotiation tactics were tough.,The lawyer's negotiation tactics were lenient.,1,1,103,
The plastic plate shattered and looked like A spiderweb,It shattered into a lot of pieces.,It only shattered into 2 pieces.,0,1,106,
The plastic plate shattered and looked like A half moon,It shattered into a lot of pieces.,It only shattered into 2 pieces.,1,1,106,
The apartment was as high up as The empire State building observation deck.,The apartment was on the high floor.,The apartment was only a few floors up,0,1,107,
The apartment was as high up as A treehouse in the backyard,The apartment was on the high floor.,The apartment was only a few floors up,1,1,107,
The man had the features of a Greek god,The man was very attractive,The man was goofy and ugly,0,1,110,
The man had the features of a clown,The man was very attractive,The man was goofy and ugly,1,1,110,
The pug was wheezing in dog form.,The dog is tired and has trouble breathing.,The dog has a ton of energy.,0,1,112,
The pug was lightning in dog form.,The dog is tired and has trouble breathing.,The dog has a ton of energy.,1,1,112,
That movie has the humor of a nun.,The movie is not funny.,The movie is very funny.,0,1,113,
That movie has the humor of a clown bus.,The movie is not funny.,The movie is very funny.,1,1,113,
The movie has a depth of A crater.,The movie has a deep meaning.,The movie is superficial.,0,1,115,
The movie has a depth of A crack.,The movie has a deep meaning.,The movie is superficial.,1,1,115,
The gambler thought his odds were as low as the ground.,His odds were low.,His odds were actually high.,0,1,119,
The gambler thought his odds were as low as the moon.,His odds were low.,His odds were actually high.,1,1,119,
The dancer was as graceful as a swan.,The dancer was graceful.,The dancer was boorish and uncoordinated.,0,1,120,
The dancer was as graceful as a honking goose.,The dancer was graceful.,The dancer was boorish and uncoordinated.,1,1,120,
He was as smart as A tree stump,The person is dumb,The person is a genius,0,1,125,
He was as smart as EINSTEIN,The person is dumb,The person is a genius,1,1,125,
The stock value was a geyser,The stock value increased.,The stock value stayed stagnant.,0,1,128,
The stock value was a puddle,The stock value increased.,The stock value stayed stagnant.,1,1,128,
The couch had all the comfort of a thornbush.,The couch was very comfortable.,The couch was not very comfortable.,0,1,131,
The couch had all the comfort of a grandma's hug.,The couch was very comfortable.,The couch was not very comfortable.,1,1,131,
The ballerina has all to grace of A club-footed drunk,The ballerina is clumsy,The ballerina is graceful,0,1,133,
The ballerina has all to grace of A swan gently swimming in a pond,The ballerina is clumsy,The ballerina is graceful,1,1,133,
The tennis match contained all the suspense of A boring and endless Monopoly game,The tennis match is tedious and boring,The tennis match is suspenseful and exciting,0,1,134,
The tennis match contained all the suspense of An Alfred Hitchcock movie,The tennis match is tedious and boring,The tennis match is suspenseful and exciting,1,1,134,
He is faithful as a church goer,he is good,he is bad,0,1,135,
He is faithful as a strip club VIP,he is good,he is bad,1,1,135,
The incense had the smell of a homemade apple pie after skipping lunch,The incense smelled quite good,The incense didn't smell good at all,0,1,138,
The incense had the smell of a wet dog wearing gym socks,The incense smelled quite good,The incense didn't smell good at all,1,1,138,
The girl had the thirst of a man after finishing a 128 oz slushie,The girl was not thirsty,The girl was very thirsty,0,1,139,
The girl had the thirst of a mid-'00s SUV after a short drive,The girl was not thirsty,The girl was very thirsty,1,1,139,
The backpack had the space of a school bus in the middle of the night,The backpack had a lot of space,There was little space in the backpack,0,1,140,
The backpack had the space of a school bus on a field trip to a pizza party,The backpack had a lot of space,There was little space in the backpack,1,1,140,
The coffee was as strong as an army,The coffee was very strong,The coffee was very weak,0,1,142,
The coffee was as strong as diluted milk,The coffee was very strong,The coffee was very weak,1,1,142,
The room was as dark as a pay phone,The room was very dark,"The room was not dark, but not well lit",0,1,143,
The room was as dark as a raincloud,The room was very dark,"The room was not dark, but not well lit",1,1,143,
The sun shined like a flame.,The sun was very bright.,"The sun was dim or obscured, not bright at all.",0,1,144,
The sun shined like a burned-out bulb.,The sun was very bright.,"The sun was dim or obscured, not bright at all.",1,1,144,
Christmas was as lively as a party.,Christmas was lively and festive.,"Christmas was quiet, lonely, and devoid of activity.",0,1,145,
Christmas was as lively as a morgue.,Christmas was lively and festive.,"Christmas was quiet, lonely, and devoid of activity.",1,1,145,
The movie has the thrill of a dentist's visit,The movie is dull.,The movie is exciting.,0,1,151,
The movie has the thrill of a carnival ride,The movie is dull.,The movie is exciting.,1,1,151,
The book plot has the novelty of an iPhone 4,The book plot is stale.,The book plot is really novel.,0,1,152,
The book plot has the novelty of a robot with feelings,The book plot is stale.,The book plot is really novel.,1,1,152,
"My shoulder hurts as much as stepping on a jagged, rusty nail",It hurts a lot,It barely hurts at all,0,1,153,
My shoulder hurts as much as getting hit with a silk pillow,It hurts a lot,It barely hurts at all,1,1,153,
The hostess is a dental drill.,The hostess is unpleasant.,The hostess is delightful.,0,1,156,
The hostess is a sweet potato pie.,The hostess is unpleasant.,The hostess is delightful.,1,1,156,
The wrinkle cream is an outhouse.,The wrinkle cream is disgusting.,The wrinkle cream is pleasant.,0,1,157,
The wrinkle cream is a purring kitten.,The wrinkle cream is disgusting.,The wrinkle cream is pleasant.,1,1,157,
She was gleaming like headlights,she was bright,she was dark,0,1,163,
She was gleaming like midnight,she was bright,she was dark,1,1,163,
This sand is as coarse as a silkworm's thread,It's not coarse at all,It's very rough,0,1,175,
This sand is as coarse as the discourse at a Thanksgiving dinner,It's not coarse at all,It's very rough,1,1,175,
The pool has the wetness of the planet Kamino,It's very wet,It's very dry,0,1,176,
The pool has the wetness of the planet Tatooine,It's very wet,It's very dry,1,1,176,
Quitting the job was as satisfying as an ice cream cone on a summer day,Quitting the job was totally satisfying.,Quitting the job gave no satisfaction.,0,1,180,
Quitting the job was as satisfying as a prickly rose bush,Quitting the job was totally satisfying.,Quitting the job gave no satisfaction.,1,1,180,
The music has the sound of a jackhammer,The music is loud,The music is soft,0,1,181,
The music has the sound of a baby bird,The music is loud,The music is soft,1,1,181,
The jacket has the feeling of sandpaper,The jacket is rough,The jacket is smooth,0,1,182,
The jacket has the feeling of butter,The jacket is rough,The jacket is smooth,1,1,182,
She was skilled like a scientist.,She was very skilled.,She was not at all skillful.,0,1,185,
She was skilled like a bum.,She was very skilled.,She was not at all skillful.,1,1,185,
His vision was as cloudy as the sky during a hurricane,It is hard to see through,it is clear,0,1,190,
His vision was as cloudy as a glass of water,It is hard to see through,it is clear,1,1,190,
She is as clumsy as an octopus on roller skates,she is a klutz,she is careful,0,1,191,
She is as clumsy as a squirrel in a tree,she is a klutz,she is careful,1,1,191,
The teacher had all the charisma of a leader,The teacher was charismatic,The teacher was foolish,0,1,195,
The teacher had all the charisma of a clown,The teacher was charismatic,The teacher was foolish,1,1,195,
The pie crust was as flaky as dandruff,The pie crust was totally flaky.,The pie crust was tough.,0,1,199,
The pie crust was as flaky as a lead block,The pie crust was totally flaky.,The pie crust was tough.,1,1,199,
The movie ending made as much sense as a pig in a pen,The movie ending made total sense.,The movie ending didn't make any sense.,0,1,200,
The movie ending made as much sense as a fish on a mountain,The movie ending made total sense.,The movie ending didn't make any sense.,1,1,200,
The ski slope is a dimple.,The ski slope is easy.,The ski slope is difficult.,0,1,202,
The ski slope is Cyrano De Bergerac's nose.,The ski slope is easy.,The ski slope is difficult.,1,1,202,
She was as free as a bird.,She was very free.,She wasn't free at all.,0,1,204,
She was as free as a zoo animal.,She was very free.,She wasn't free at all.,1,1,204,
She was as entertaining as a lecture.,She wasn't entertaining.,She was very entertaining.,0,1,205,
She was as entertaining as a television show.,She wasn't entertaining.,She was very entertaining.,1,1,205,
Getting the whole school evacuated in a raging fire is as easy as counting ten pennies,Getting the whole school evacuated in a raging fire is simple.,Getting the whole school evacuated in a raging fire is nearly impossible,0,1,207,
Getting the whole school evacuated in a raging fire is as easy as climbing the Swiss Alps.,Getting the whole school evacuated in a raging fire is simple.,Getting the whole school evacuated in a raging fire is nearly impossible,1,1,207,
The building is as well constructed as the straw house  the pigs built that the wolf blew down,The building is falling apart,The building is 100% safe,0,1,208,
The building is as well constructed as The brick house the wolf could not blow doen,The building is falling apart,The building is 100% safe,1,1,208,
The head of our country is as smart as a a turkey,The head of our country is very dumb.,The head of our country is very smart.,0,1,209,
The head of our country is as smart as an orangutang,The head of our country is very dumb.,The head of our country is very smart.,1,1,209,
The future is as bright as the sun,The future is bright,The future is not bright,0,1,211,
The future is as bright as ink,The future is bright,The future is not bright,1,1,211,
The cat had the fur of a Yeti,The cat was furry,The cat was not furry,0,1,215,
The cat had the fur of a baby's bottom,The cat was furry,The cat was not furry,1,1,215,
She thinks of herself as the mother of humanity.,She is self-righteous and entitled.,She is humble and respectful towards the different people.,0,1,223,
She thinks of herself as a particle of sand in the desert.,She is self-righteous and entitled.,She is humble and respectful towards the different people.,1,1,223,
He was as cautious as a mother with a newborn,he is careful,he is reckless,0,1,225,
He was as cautious as a drunk driver on the highway,he is careful,he is reckless,1,1,225,
The dog is as charming as a salesman,the dog is flattering,the dog is gross,0,1,226,
The dog is as charming as a sick racoon,the dog is flattering,the dog is gross,1,1,226,
The girl is as cheerful as a kid in a toy store,she is happy,she is sad,0,1,227,
The girl is as cheerful as a mom at a funeral,she is happy,she is sad,1,1,227,
The bathroom has the space of Neptune's orbit around the sun,The bathroom is spacious,The bathroom is cramped,0,1,230,
The bathroom has the space of an egg with a baby chicken in it,The bathroom is spacious,The bathroom is cramped,1,1,230,
Her beauty is like the vaquita.,Her beauty is quite rare.,Her beauty is pretty common.,0,1,231,
Her beauty is like the Peruvian anchoveta.,Her beauty is quite rare.,Her beauty is pretty common.,1,1,231,
The boys are feeling like burrowing shrews today.,The boys are very active today.,The boys are moving sluggish today.,0,1,232,
The boys are feeling like nurse sharks today.,The boys are very active today.,The boys are moving sluggish today.,1,1,232,
The disease was as serious as a funeral,The disease was very serious,The disease was not serious,0,1,234,
The disease was as serious as a hangnail,The disease was very serious,The disease was not serious,1,1,234,
The doctor was dressed like Liberace,The doctor was dressed well,The doctor was dressed poorly,0,1,235,
The doctor was dressed like a car repairman,The doctor was dressed well,The doctor was dressed poorly,1,1,235,
The reporter has the charisma of a sloth,The reporter is boring,The report is over excited,0,1,236,
The reporter has the charisma of a Jack Russel terrier,The reporter is boring,The report is over excited,1,1,236,
The wood floor is as slippery as a piece of sand paper,The floor is not slippery at all,The floor is super slippery.,0,1,238,
The wood floor is as slippery as a banana peel,The floor is not slippery at all,The floor is super slippery.,1,1,238,
The reporter was so high he could hunt ducks with a rake,The reporter was under the influence of drugs,The reporter was not drugged at all.,0,1,239,
The reporter was so high he could do differential equations with ease,The reporter was under the influence of drugs,The reporter was not drugged at all.,1,1,239,
The gorilla tape was sticky like melted chocolate bars in a wrapper.,The tape was gooey and unwilling to release,The tape was dry and fluffy,0,1,240,
The gorilla tape was sticky like dried mouse nest material.,The tape was gooey and unwilling to release,The tape was dry and fluffy,1,1,240,
"Death, the harvester of souls, waited outside the door like a drooling dog sitting at the base of a tree waiting for a squirrel.",Death was patiently waiting,Death ran around in every direction simultaneously.,0,1,241,
"Death, the harvester of souls, waited outside the door like a kindergarten class that ran out of Ritalin while in a puppy farm",Death was patiently waiting,Death ran around in every direction simultaneously.,1,1,241,
"On the field, the soccer player was a tornado","On the field, the soccer player was very aggressive.","On the field, the soccer player wasn't very impactful.",0,1,242,
"On the field, the soccer player was a light breeze","On the field, the soccer player was very aggressive.","On the field, the soccer player wasn't very impactful.",1,1,242,
The wine tasted of my lover's lips,The wine tasted great.,The wine tasted lousy.,0,1,246,
The wine tasted of old shoes,The wine tasted great.,The wine tasted lousy.,1,1,246,
The effects of the disease on her body was an earthquake,The effects were devestating,The effects were minimal,0,1,249,
The effects of the disease on her body was a raindrop,The effects were devestating,The effects were minimal,1,1,249,
The article from the reporter has the insights of A first grader's primer,The article is shallow and lacks depth,The article is deep and meaningful,0,1,251,
The article from the reporter has the insights of An expert journalist,The article is shallow and lacks depth,The article is deep and meaningful,1,1,251,
Her cheeks were the color of a delicate rose,Her cheeks were pink,Her cheeks were white,0,1,258,
Her cheeks were the color of chalk,Her cheeks were pink,Her cheeks were white,1,1,258,
He's busy as a beaver,He's busy.,"He's lazy, not busy at all.",0,1,261,
He's busy as a sloth,He's busy.,"He's lazy, not busy at all.",1,1,261,
The book is as thick as a board,The book is thick.,The book is thin.,0,1,262,
The book is as thick as piece of paper,The book is thick.,The book is thin.,1,1,262,
The man has the build of Hercules,The man is very muscular.,The man doesn't have any muscles.,0,1,264,
The man has the build of a third-grader,The man is very muscular.,The man doesn't have any muscles.,1,1,264,
The whale is as a mountain,The whale is enormous.,The whale is small.,0,1,266,
The whale is as a tadpole,The whale is enormous.,The whale is small.,1,1,266,
The computer is as fast as a fighter jet.,The computer is fast.,The computer is slow.,0,1,267,
The computer is as fast as a snail.,The computer is fast.,The computer is slow.,1,1,267,
He is as brave as a mouse,He is a coward,He is brave,0,1,269,
He is as brave as a lion,He is a coward,He is brave,1,1,269,
the dog was as friendly as a bunny,it was nice,it was mean,0,1,273,
the dog was as friendly as a snake,it was nice,it was mean,1,1,273,
Talking to him was like trying to corner a snake,He was duplicitous,He was dangerous,0,1,275,
Talking to him was like trying to corner a rabid dog,He was duplicitous,He was dangerous,1,1,275,
The stain was as dark as midnight,the stain was easy to point out,the stain was light,0,1,279,
The stain was as dark as noon,the stain was easy to point out,the stain was light,1,1,279,
