startphrase,ending1,ending2,labels,valid,qid,index
He is a Buick Century.,He is modern.,He is out-of-date.,1,1,X2217,5304.0
She is worth 10 XP,She is inexperienced.,She is experienced.,0,1,X2218,5305.0
She is worth 10000 XP.,She is inexperienced.,She is experienced.,1,1,X2218,5306.0
The man was as strong as a bull,The man was strong,The man was not strong,0,1,X2219,5307.0
The man was as strong as a fly,The man was strong,The man was not strong,1,1,X2219,5308.0
The message in a bottle sailed the ocean like pirate ship,The bottle sailed quickly,The bottle stayed in one place,0,1,X2220,5309.0
The message in a bottle sailed the ocean like bobbing cork,The bottle sailed quickly,The bottle stayed in one place,1,1,X2220,5310.0
The puzzle was as complicated as rocket science,The puzzle was difficult,The puzzle was easy,0,1,X2221,5311.0
The puzzle was as complicated as the alphabet,The puzzle was difficult,The puzzle was easy,1,1,X2221,5312.0
This lasagna has the flavor of Stale cardboard,The lasagna is below acceptable,The lasagna is excellent!,0,1,X2222,5317.0
This lasagna has the flavor of Buca di beppo,The lasagna is below acceptable,The lasagna is excellent!,1,1,X2222,5318.0
The puzzle has the difficulty level of A riddle for infants,The puzzle is very easy,The puzzle is very difficult,0,1,X2223,5319.0
The puzzle has the difficulty level of A thousand-sided Rubik's Cube,The puzzle is very easy,The puzzle is very difficult,1,1,X2223,5320.0
The bottle's glass is as clear as A stained glass window,The bottle's glass is not transparent,The bottle's glass is very clear and transparent,0,1,X2224,5321.0
The bottle's glass is as clear as Looking through binoculars,The bottle's glass is not transparent,The bottle's glass is very clear and transparent,1,1,X2224,5322.0
The choreography has the complexity of A one-man standup comedy act,The choreography is very simple,The choreography is complex,0,1,X2225,5323.0
The choreography has the complexity of A multiprocessor supercomputer,The choreography is very simple,The choreography is complex,1,1,X2225,5324.0
The woman reminded them that her boyfriend was as strong as A chain on a dogs neck,Her boyfriend was very strong,There wasn't much strength,0,1,X2226,5327.0
The woman reminded them that her boyfriend was as strong as A fishing line,Her boyfriend was very strong,There wasn't much strength,1,1,X2226,5328.0
The shape of the bottle was as familiar to the woman as The size of her waist,The shape was very familiar,The shape was unknown,0,1,X2227,5329.0
The shape of the bottle was as familiar to the woman as The number of votes cast in the previous election,The shape was very familiar,The shape was unknown,1,1,X2227,5330.0
The complicated puzzle would take them as long to put together as It took to assemble their bookshelf,Putting the puzzle together would be relatively quick,It would take too long to put the puzzle together,0,1,X2228,5331.0
The complicated puzzle would take them as long to put together as It took to assemble the Eiffel Tower,Putting the puzzle together would be relatively quick,It would take too long to put the puzzle together,1,1,X2228,5332.0
The drink was as strong as water,The drink was not strong,The drink was strong,0,1,X2229,5333.0
The drink was as strong as a punch in the gut,The drink was not strong,The drink was strong,1,1,X2229,5334.0
The bottle was sealed as tight as Fort Knox,The bottle was sealed tight,The bottle was not sealed tight,0,1,X2230,5335.0
The bottle was sealed as tight as an XXXXXL tee,The bottle was sealed tight,The bottle was not sealed tight,1,1,X2230,5336.0
Solving the puzzle was as easy as petting a dog,Solving the puzzle was easy,Solving the puzzle was not easy,0,1,X2231,5337.0
Solving the puzzle was as easy as painting the Sistine Chapel,Solving the puzzle was easy,Solving the puzzle was not easy,1,1,X2231,5338.0
To him the stack if paperwork looked like It could rival Jack's beanstalk in height.,To him the stack of paperwork was endless and towering,To him the stack of paperwork was short.,0,1,X2232,5339.0
To him the stack if paperwork looked like a thin slice of ham.,To him the stack of paperwork was endless and towering,To him the stack of paperwork was short.,1,1,X2232,5340.0
Their shoulders had the weight of Ten thousand stars.,Their shoulders felt heavy and burdened.,Their shoulders felt light.,0,1,X2233,5341.0
Their shoulders had the weight of A hollow feather.,Their shoulders felt heavy and burdened.,Their shoulders felt light.,1,1,X2233,5342.0
"Seeing the old juke box was like visiting a nasty, useless junkyard",Seeing the old juke box was an eye sore.,Seeing the old juke box was a reminder of older times.,0,1,X2234,5343.0
Seeing the old juke box was like a key that opens a door of old memories.,Seeing the old juke box was an eye sore.,Seeing the old juke box was a reminder of older times.,1,1,X2234,5344.0
The hero was as mighty as an ox,the hero was strong,the hero was weak,0,1,X2235,5345.0
The hero was as mighty as an ant,the hero was strong,the hero was weak,1,1,X2235,5346.0
The dog was as quick as a jaguar,the dog was fast,the dog was slow,0,1,X2236,5347.0
The dog was as quick as a turtle on vacation,the dog was fast,the dog was slow,1,1,X2236,5348.0
the bathroom was as clean as a sewer,it was nasty,it was clean as it could be,0,1,X2237,5349.0
the bathroom was as clean as a pastor's phone,it was nasty,it was clean as it could be,1,1,X2237,5350.0
It ascended like a balloon off it's string,It ascends a lot,It doesn't ascend at all,0,1,X2238,5351.0
It ascended like a Safe,It ascends a lot,It doesn't ascend at all,1,1,X2238,5352.0
They're about as similar as Pepsi and Coke,They're very similar,They aren't similar at all.,0,1,X2239,5355.0
They're about as similar as Cake and Hot Sauce,They're very similar,They aren't similar at all.,1,1,X2239,5356.0
The children are rugrats,The children can't walk.,The children can't sit still.,0,1,X2240,5359.0
The children are bouncy like a flea,The children can't walk.,The children can't sit still.,1,1,X2240,5360.0
A corporation is as much a person as a pet rock,A corporation is not a person,A corporation is a person,0,1,X2241,5365.0
A corporation is as much a person as one's best friend,A corporation is not a person,A corporation is a person,1,1,X2241,5366.0
She had the personal hygiene of a homeless drunk,She had bad personal hygiene,She had good personal hygiene,0,1,X2242,5367.0
She had the personal hygiene of a surgeon in the operating room,She had bad personal hygiene,She had good personal hygiene,1,1,X2242,5368.0
He worked as hard as dead slug,He did not work hard,He worked hard,0,1,X2243,5369.0
He worked as hard as a one-handed acrobat,He did not work hard,He worked hard,1,1,X2243,5370.0
His feelings are as fragile as a diamond,"His feelings are hard, not fragile",His feelings are easily hurt,0,1,X2244,5373.0
His feelings are as fragile as balsa wood,"His feelings are hard, not fragile",His feelings are easily hurt,1,1,X2244,5374.0
She's as smart as a rocket scientist,She is extremely smart,She is not very smart at all,0,1,X2245,5375.0
She's as smart as a toaster,She is extremely smart,She is not very smart at all,1,1,X2245,5376.0
The girl's ego has the strength of spider silk,The girl has a strong ego.,The girl has a fragile ego.,0,1,X2246,5377.0
The girl's ego has the strength of a glass flute,The girl has a strong ego.,The girl has a fragile ego.,1,1,X2246,5378.0
The woman is as generous as a Thanksgiving buffet,The woman is very generous.,The woman is a cheapskate.,0,1,X2247,5379.0
The woman is as generous as an appetizer,The woman is very generous.,The woman is a cheapskate.,1,1,X2247,5380.0
The boy has the creativity of a telephone pole,The boy is not creative.,The boy is very creative.,0,1,X2248,5381.0
The boy has the creativity of a gallery,The boy is not creative.,The boy is very creative.,1,1,X2248,5382.0
That person has the voice of a songbird,That person's voice is light and pleasant,That person's voice is loud and cacaphonic,0,1,X2249,5383.0
That person has the voice of a foghorn,That person's voice is light and pleasant,That person's voice is loud and cacaphonic,1,1,X2249,5384.0
I'm as fragile as a vase,I'm very fragile,I'm very tough,0,1,X2250,5385.0
I'm as fragile as a brick,I'm very fragile,I'm very tough,1,1,X2250,5386.0
I work as hard as an ant,I work hard,I don't work hard,0,1,X2251,5387.0
I work as hard as a sloth,I work hard,I don't work hard,1,1,X2251,5388.0
The person's emotion has the fragility of a butterfly.,The person is emotionally weak.,The person is emotionally strong.,0,1,X2252,5389.0
The person's emotion has the fragility of bull unscathed by all the years of fighting in the wild.,The person is emotionally weak.,The person is emotionally strong.,1,1,X2252,5390.0
The pancake has the properties of fluffy birthday cake.,The pancake is soft.,The pancake is stiff.,0,1,X2253,5391.0
The pancake has the properties of a hockey puck.,The pancake is soft.,The pancake is stiff.,1,1,X2253,5392.0
The bathroom has the smell a beautiful women's perfume.,The bathroom smells good.,The bathroom smells bad.,0,1,X2254,5393.0
The bathroom has the smell of an expired milk left outside in room temperature.,The bathroom smells good.,The bathroom smells bad.,1,1,X2254,5394.0
She was as late as a dead guy to his job,she was really late,she was really early,0,1,X2255,5395.0
She was as late as A early bird to the worm,she was really late,she was really early,1,1,X2255,5396.0
His blood was darker than midnight,the blood was dark,the blood was light,0,1,X2256,5397.0
His blood was darker than noon,the blood was dark,the blood was light,1,1,X2256,5398.0
The event was as significant as a car driving,it was common,it was rare,0,1,X2257,5399.0
The event was as significant as a winning lotto ticket,it was common,it was rare,1,1,X2257,5400.0
The syrup had the thickness of a female character designed by 4chan's /co/ board,The syrup was very thick,The syrup had no thickness,0,1,X2258,5401.0
The syrup had the thickness of a fully melted ice cube,The syrup was very thick,The syrup had no thickness,1,1,X2258,5402.0
The baseball game went on for the length of The Lord of the Rings Trilogy Extended Edition,The baseball game went on for a long time,The baseball game was over quickly,0,1,X2259,5403.0
The baseball game went on for the length of a 1-year-old's birthday party,The baseball game went on for a long time,The baseball game was over quickly,1,1,X2259,5404.0
He was as handsome as the vampires in Twilight,He was very handsome,He was very ugly,0,1,X2260,5405.0
He was as handsome as the vampire in Nosferatu,He was very handsome,He was very ugly,1,1,X2260,5406.0
I had the wealth of a tycoon,I was wealthy,I was poor,0,1,X2261,5407.0
I had the wealth of a bum,I was wealthy,I was poor,1,1,X2261,5408.0
The bed was as soft as a cloud,The bed was soft,The bed was hard,0,1,X2262,5409.0
The bed was as soft as concrete,The bed was soft,The bed was hard,1,1,X2262,5410.0
His teeth shined like pearls,His teeth were shiny,His teeth were dull and not shiny,0,1,X2263,5411.0
His teeth shined like dirt,His teeth were shiny,His teeth were dull and not shiny,1,1,X2263,5412.0
The dancing couple has the grace of an epileptic seizure,The couple danced poorly,The couple danced gracefully,0,1,X2264,5413.0
The dancing couple has the grace of a figure skater,The couple danced poorly,The couple danced gracefully,1,1,X2264,5414.0
The complaints have the significance of a rock in a quarry,The complaints are trivial,The complaints are serious,0,1,X2265,5415.0
The complaints have the significance of a nuclear war,The complaints are trivial,The complaints are serious,1,1,X2265,5416.0
The arrival prompted all the fanfare of a tired yawn,The arrival was unremarkable,The arrival was exciting,0,1,X2266,5417.0
The arrival prompted all the fanfare of a contestant crossing the finish line,The arrival was unremarkable,The arrival was exciting,1,1,X2266,5418.0
She was as adorable as a small kitten,She was very cute and small,She was ugly cute,0,1,X2267,5421.0
She was as adorable as a pug,She was very cute and small,She was ugly cute,1,1,X2267,5422.0
The woman was as cruel as a homicide,The woman was very cruel.,The woman was very kind.,0,1,X2268,5433.0
The woman was as cruel as a Valentine,The woman was very cruel.,The woman was very kind.,1,1,X2268,5434.0
The woman's personality was as sweet as a lollipop,The woman's personality was sweet.,The woman's personality was sour.,0,1,X2269,5435.0
The woman's personality was as sweet as a War Head,The woman's personality was sweet.,The woman's personality was sour.,1,1,X2269,5436.0
The soccer team played with the coordination of a tornado,The soccer team played in a very uncoordinated manner.,The soccer team played in a very coordinated manner.,0,1,X2270,5437.0
The soccer team played with the coordination of an orchestra,The soccer team played in a very uncoordinated manner.,The soccer team played in a very coordinated manner.,1,1,X2270,5438.0
His head is as big as a watermelon,the head is large,his head is small,0,1,X2271,5445.0
His head is as big as a pea,the head is large,his head is small,1,1,X2271,5446.0
The bear ran as fast as lightning in a storm,the bear was fast,the bear was slow,0,1,X2272,5447.0
The bear ran as fast as a slug on drugs,the bear was fast,the bear was slow,1,1,X2272,5448.0
The fight was as ugly as a spider with fur,the fight was violent,the fight was tame,0,1,X2273,5449.0
The fight was as ugly as a newborn baby,the fight was violent,the fight was tame,1,1,X2273,5450.0
The man's head is a hot air baloon,The man's head is very large.,The man's head is very small.,0,1,X2274,5451.0
The man's head is a marble,The man's head is very large.,The man's head is very small.,1,1,X2274,5452.0
The woman's breasts are planets,Her boobs are huge.,Her boobs are tiny.,0,1,X2275,5453.0
The woman's breasts are grapes,Her boobs are huge.,Her boobs are tiny.,1,1,X2275,5454.0
Her head was the size of an apple,Her head was small,Her head was big,0,1,X2276,5459.0
Her head was the size of a basketball,Her head was small,Her head was big,1,1,X2276,5460.0
The road sign was as informative as an empty notebook,The road sign was not informative,The road sign was informative,0,1,X2277,5461.0
The road sign was as informative as an encyclopedia,The road sign was not informative,The road sign was informative,1,1,X2277,5462.0
The leaves were as colorful as a coffin,The leaves were not colorful,The leaves were colorful,0,1,X2278,5463.0
The leaves were as colorful as a kaleidoscope,The leaves were not colorful,The leaves were colorful,1,1,X2278,5464.0
She was beautiful like a toadstool.,She was ugly.,She was very beautiful.,0,1,X2279,5465.0
She was beautiful like a daisy.,She was ugly.,She was very beautiful.,1,1,X2279,5466.0
He was flashy like a camera.,He was very flashy.,He wasn't flashy at all.,0,1,X2280,5469.0
He was flashy like a hole.,He was very flashy.,He wasn't flashy at all.,1,1,X2280,5470.0
Hair is a crown.,"Hair is a pretty, unessential adornment.",Hair is plain protection for the head.,0,1,X2281,5473.0
Hair is a helmet.,"Hair is a pretty, unessential adornment.",Hair is plain protection for the head.,1,1,X2281,5474.0
The kid has the wealth of knowledge of a peanut.,The kid is stupid.,The kid is smart.,0,1,X2282,5477.0
The kid has the wealth of knowledge of the next Einstein.,The kid is stupid.,The kid is smart.,1,1,X2282,5478.0
This weather reminds me of me being in my gym's sauna.,The weather is hot.,The weather is cold.,0,1,X2283,5479.0
This weather reminds me of me wading through the frozen lake naked.,The weather is hot.,The weather is cold.,1,1,X2283,5480.0
This hotel reminds me of the Taj Mahal.,This hotel is grand.,This hotel is poor.,0,1,X2284,5481.0
This hotel reminds me of the homeless shelter.,This hotel is grand.,This hotel is poor.,1,1,X2284,5482.0
The chair is as comfortable as a rock slab,The chair is really uncomfortable.,The chair is really comfortable.,0,1,X2285,5483.0
The chair is as comfortable as a pillow,The chair is really uncomfortable.,The chair is really comfortable.,1,1,X2285,5484.0
The book's plot is as straightforward as a grocery list,The book's plot is really straightforward.,The book's plot is really complicated.,0,1,X2286,5485.0
The book's plot is as straightforward as geometry homework,The book's plot is really straightforward.,The book's plot is really complicated.,1,1,X2286,5486.0
The boy's dinner portion size was as big as a lion,The boy's dinner portion size was huge.,The boy's dinner portion size was small.,0,1,X2287,5487.0
The boy's dinner portion size was as big as a penny,The boy's dinner portion size was huge.,The boy's dinner portion size was small.,1,1,X2287,5488.0
Married life is sweet cake.,Married life is wonderful experience.,Married life is an awful experience.,0,1,X2288,5491.0
Married life is a bitter drink.,Married life is wonderful experience.,Married life is an awful experience.,1,1,X2288,5492.0
Her life is a scary movie.,Her life is full of awful experiences.,Her life is full of beautiful experiences.,0,1,X2289,5493.0
Her life is a journey to paradise.,Her life is full of awful experiences.,Her life is full of beautiful experiences.,1,1,X2289,5494.0
The drugs were as potent as an atom bomb,the drugs were strong,The drugs were weak,0,1,X2290,5495.0
The drugs were as potent as a couple of aspirin past their expiration date,the drugs were strong,The drugs were weak,1,1,X2290,5496.0
The pate had the texture of savory silk,The pate was excellent.,The pate was inedible.,0,1,X2291,5497.0
The pate had the texture of canned dog food,The pate was excellent.,The pate was inedible.,1,1,X2291,5498.0
The car took off like F-15 Eagle,The car was fast,The car was slow,0,1,X2292,5499.0
The car took off like a drunken tortoise,The car was fast,The car was slow,1,1,X2292,5500.0
The bed was as comfortable as a cradle of caressing pillows.,The bed was very comfortable.,The bed was very uncomfortable.,0,1,X2293,5507.0
The bed was as comfortable as sleeping naked on roof shingles.,The bed was very comfortable.,The bed was very uncomfortable.,1,1,X2293,5508.0
The training was as useful as a pair of waterskis in the Sahara.,The training was useless.,The training was critically useful.,0,1,X2294,5509.0
The training was as useful as an oxygen to trapped miners.,The training was useless.,The training was critically useful.,1,1,X2294,5510.0
She kept as still as the Washington Monument,She kept still,She did not keep still,0,1,X2295,5513.0
She kept as still as a bouncing superball,She kept still,She did not keep still,1,1,X2295,5514.0
The reporter wrote like a monkey on crack,The reporter wrote badly,The reporter wrote well,0,1,X2296,5515.0
The reporter wrote like Hemingway,The reporter wrote badly,The reporter wrote well,1,1,X2296,5516.0
The future seems as bright as the Arctic winter,The future seems dull,The future seems bright,0,1,X2297,5517.0
The future seems as bright as a welding torch,The future seems dull,The future seems bright,1,1,X2297,5518.0
The reporter got a scoop that was a platinum mine,the scoop was good,the scoop was bad,0,1,X2298,5519.0
The reporter got a scoop that was a lump of sand,the scoop was good,the scoop was bad,1,1,X2298,5520.0
The apartment was a hamster cage,the apartment was small,the apartment was huge,0,1,X2299,5523.0
The apartment was an Empire State Building,the apartment was small,the apartment was huge,1,1,X2299,5524.0
The football field's a theatre and you're a prop,The individual is statuesque and hidden in the background,The individual is graceful and the focus of one's attention,0,1,X2300,5525.0
The football field's a theatre and you're a ballerina,The individual is statuesque and hidden in the background,The individual is graceful and the focus of one's attention,1,1,X2300,5526.0
Life is simply a board game of Risk,Life is full of battles and turmoil where only one side is victorious,Life is full of wonder and color where the experience is beneficial to all,0,1,X2301,5527.0
Life is simply a board game of Candyland,Life is full of battles and turmoil where only one side is victorious,Life is full of wonder and color where the experience is beneficial to all,1,1,X2301,5528.0
My wife was the torch to light my way,The wife was what brought the individual out of darkness and into prosperity,The wife was dragging one's entire life down and into depression,0,1,X2302,5529.0
My wife was the sandbag tied to my foot,The wife was what brought the individual out of darkness and into prosperity,The wife was dragging one's entire life down and into depression,1,1,X2302,5530.0
The moonshiner's still was a spider mite,the still was small,the still was large,0,1,X2303,5533.0
The moonshiner's still was a giant squid,the still was small,the still was large,1,1,X2303,5534.0
The reporter was a roach motel,The reporter was ineffective,The reporter was effective,0,1,X2304,5535.0
The reporter was a Bear snap trap,The reporter was ineffective,The reporter was effective,1,1,X2304,5536.0
The boy's future was an empty coloring book,"The boy's future was wide open, unforseen","The boy's future was fully laid out, forseen",0,1,X2305,5537.0
The boy's future was A colorful coffee table book,"The boy's future was wide open, unforseen","The boy's future was fully laid out, forseen",1,1,X2305,5538.0
He runs like a stallion,he runs well,he runs badly,0,1,X2306,5541.0
He runs like a donkey,he runs well,he runs badly,1,1,X2306,5542.0
those kids were behaving like kittens,those kids were adorable,those kids were annoying,0,1,X2307,5543.0
those kids were behaving like cockroaches,those kids were adorable,those kids were annoying,1,1,X2307,5544.0
That man is as healthy as an ox.,The man is very healthy and robust.,The man is not healthy at all.,0,1,X2308,5545.0
That man is as healthy as a fish on land.,The man is very healthy and robust.,The man is not healthy at all.,1,1,X2308,5546.0
The classroom was as crowded as a store on Black Friday.,The classroom is very crowded.,The classroom is not crowded and basically empty.,0,1,X2309,5547.0
The classroom was as crowded as a Blockbuster Video.,The classroom is very crowded.,The classroom is not crowded and basically empty.,1,1,X2309,5548.0
That movie was as scary as a wild animal attack.,The movie was very scary.,The movie wasn't scary at all.,0,1,X2310,5549.0
That movie was as scary as a carebear.,The movie was very scary.,The movie wasn't scary at all.,1,1,X2310,5550.0
Children are like a flower seed.,They grow up to be beautiful creatures based on the nutrition we provide.,Children should be trained to navigate life on their own to overcome obstacles without fear.,0,1,X2311,5551.0
Children are like an airline pilot.,They grow up to be beautiful creatures based on the nutrition we provide.,Children should be trained to navigate life on their own to overcome obstacles without fear.,1,1,X2311,5552.0
Life is like a ticking clock.,"Time lost cannot be recovered again. So, use time wisely.",We should live a carefree life to stay stress free.,0,1,X2312,5555.0
Life is like a flying bird.,"Time lost cannot be recovered again. So, use time wisely.",We should live a carefree life to stay stress free.,1,1,X2312,5556.0
The instruction manual is A maze,The instructions are complicated.,The instructions are well written.,0,1,X2313,5559.0
The instruction manual is A novel,The instructions are complicated.,The instructions are well written.,1,1,X2313,5560.0
This shower is a fire hydrant.,The shower had high pressure.,The shower has low pressure.,0,1,X2314,5561.0
This shower is a soft rain.,The shower had high pressure.,The shower has low pressure.,1,1,X2314,5562.0
The house was as big as an office building,The house was very large,The house was small,0,1,X2315,5569.0
The house was as big as an ice fishing shack,The house was very large,The house was small,1,1,X2315,5570.0
The pie was as sweet as a child helping clean,The pie was very sweet,The pie was bitter,0,1,X2316,5571.0
The pie was as sweet as a mean junkyard dog,The pie was very sweet,The pie was bitter,1,1,X2316,5572.0
The fire burned as long as a three part movie,The fire burned a long time,The fire burned quickly,0,1,X2317,5573.0
The fire burned as long as a stop at the gas station,The fire burned a long time,The fire burned quickly,1,1,X2317,5574.0
The class has the patience of an elephant charging through lions.,The class is very impatient.,The class is extremely patient.,0,1,X2318,5575.0
The class has the patience of Mr. Miyagi.,The class is very impatient.,The class is extremely patient.,1,1,X2318,5576.0
His fitness level was better than the Rock.,He was extremely fit.,He was unfit and slovenly.,0,1,X2319,5577.0
His fitness level was akin to a drunken sloth.,He was extremely fit.,He was unfit and slovenly.,1,1,X2319,5578.0
He has the class of a British royal,He is refined and well behaved,He is tactless,0,1,X2320,5581.0
He has the class of a town drunk,He is refined and well behaved,He is tactless,1,1,X2320,5582.0
I have the personal health approach of a triathlete,I am living a very healthy lifestyle,I am making bad choices for my health,0,1,X2321,5583.0
I have the personal health approach of a carnival worker,I am living a very healthy lifestyle,I am making bad choices for my health,1,1,X2321,5584.0
"When it comes to being transient, he has the mobility of an anvil",He does not like to leave his current location,He is always on the move,0,1,X2322,5585.0
"When it comes to being transient, he has the mobility of a mountain lion",He does not like to leave his current location,He is always on the move,1,1,X2322,5586.0
The light has the brightness of The sun,The light is extremely bright,The light is dark,0,1,X2323,5587.0
The light has the brightness of A cave,The light is extremely bright,The light is dark,1,1,X2323,5588.0
The sky is A window,The sky is clear,The sky is a mess/not clear,0,1,X2324,5589.0
