startphrase,ending1,ending2,labels,valid,qid,index
The book was as abridged as a parody series on YouTube,The book was fairly abridged,The book was not abridged at all,0,1,X296,700.0
The book was as abridged as a copy of the Bible that includes the Book of Judas,The book was fairly abridged,The book was not abridged at all,1,1,X296,701.0
She had the fear of a vampire and a clove of garlic,She had quite a bit of fear,She had no fear at all,0,1,X297,702.0
She had the fear of a vampire and a yellow onion,She had quite a bit of fear,She had no fear at all,1,1,X297,703.0
The room was as messy as a kid's dinner plate,its disorganized,it is clean,0,1,X298,704.0
The room was as messy as A nun's room,its disorganized,it is clean,1,1,X298,705.0
The order of the students was as random as the stock market,it is very random,it is orderly,0,1,X299,706.0
The order of the students was as random as a checker board,it is very random,it is orderly,1,1,X299,707.0
The pattern of her dress was as ugly as a baby girl,it was pretty,it was nasty,0,1,X300,708.0
The pattern of her dress was as ugly as a donkey on drugs,it was pretty,it was nasty,1,1,X300,709.0
I am as calm as a hurricane,I am not calm at all.,I am incredibly calm.,0,1,X301,716.0
I am as calm as a corpse,I am not calm at all.,I am incredibly calm.,1,1,X301,717.0
The movie has as many laughs as a funeral,The movie had no humor.,The movie is full of humor.,0,1,X302,718.0
The movie has as many laughs as a clown college,The movie had no humor.,The movie is full of humor.,1,1,X302,719.0
That kid is as sweet as a salt mine,The kid is not sweet at all,The kid is very sweet,0,1,X303,720.0
That kid is as sweet as a honey hive,The kid is not sweet at all,The kid is very sweet,1,1,X303,721.0
The room was as big as a shoebox,The room was small.,The room was large.,0,1,X304,722.0
The room was as big as a cruse ship,The room was small.,The room was large.,1,1,X304,723.0
The convention was as exciting as a funeral,The convention was very boring,The convention with interesting.,0,1,X305,724.0
The convention was as exciting as a pep rally,The convention was very boring,The convention with interesting.,1,1,X305,725.0
The shirt pattern was as colorful as an old black and white television,The shirt pattern is not colorful.,The shirt pattern is very colorful.,0,1,X306,726.0
The shirt pattern was as colorful as psychedelic tie die,The shirt pattern is not colorful.,The shirt pattern is very colorful.,1,1,X306,727.0
The cat was as playful as a kindergarden kid,The cat was playful,The cat was inactive,0,1,X307,728.0
The cat was as playful as a grumpy old man,The cat was playful,The cat was inactive,1,1,X307,729.0
The grass was as healthy as a marathon runner,The grass was green,The grass was brown,0,1,X308,730.0
The grass was as healthy as a cancer patient,The grass was green,The grass was brown,1,1,X308,731.0
The pool was as as clean as a pig sty,The pool was dirty,The pool was clean,0,1,X309,732.0
The pool was as as clean as a house showing,The pool was dirty,The pool was clean,1,1,X309,733.0
Her voice had the loudness of a girl in a slasher film when the killer shows up behind her,Her voice was very loud,Her voice was pretty quiet,0,1,X310,750.0
Her voice had the loudness of Billy Eilish trying to hold back a sneeze,Her voice was very loud,Her voice was pretty quiet,1,1,X310,751.0
That's as soft as a loaf of bread,It's very soft,It isn't soft at all,0,1,X311,754.0
That's as soft as a concrete wall,It's very soft,It isn't soft at all,1,1,X311,755.0
That's as crunchy as a crouton,It's crunchy,It's not crunchy at all,0,1,X312,756.0
That's as crunchy as mashed potatoes,It's crunchy,It's not crunchy at all,1,1,X312,757.0
That was about as expensive as the value menu,It's not expensive at all,It's very expensive,0,1,X313,758.0
That was about as expensive a Led Zeppelin concert,It's not expensive at all,It's very expensive,1,1,X313,759.0
The langauges are essentially twins,The two languages are very similar,The two languages are not similar,0,1,X314,760.0
The langauges are essentially strangers,The two languages are very similar,The two languages are not similar,1,1,X314,761.0
His intelligence stretched from one end of the universe to the other,He is really smart,He is not smart,0,1,X315,762.0
His intelligence started at noon and ends at midnight,He is really smart,He is not smart,1,1,X315,763.0
The debt in his name is a torrential downpour,He has a lot of debt and it is relentless,His debt is not that much and only accrues a little,0,1,X316,764.0
The debt in his name is sprinkle,He has a lot of debt and it is relentless,His debt is not that much and only accrues a little,1,1,X316,765.0
The watch was as accurate as an olympic time keeper,The watch told good time,The watch was told bad time,0,1,X317,766.0
The watch was as accurate as a blind archer,The watch told good time,The watch was told bad time,1,1,X317,767.0
The fish was as fresh as the first winter snow,The fish was fresh,The fish was old,0,1,X318,768.0
The fish was as fresh as a pizza at the bottom of the freezer,The fish was fresh,The fish was old,1,1,X318,769.0
The guys hair was as long as a yard stick,The guy had lompng hair,The guy had short hair,0,1,X319,770.0
The guys hair was as long as an inch worm,The guy had lompng hair,The guy had short hair,1,1,X319,771.0
Trying to learn the new language felt like Running a marathon after giving birth,The language was hard to learn,It was easy to learn the new language,0,1,X320,772.0
Trying to learn the new language felt like Having a cheat sheet for your SATs,The language was hard to learn,It was easy to learn the new language,1,1,X320,773.0
The smell in the theater caused the man to feel Excited about the movie that's coming,The theater smelled like one would expect perhaps popcorn,The theater smelled bad.,0,1,X321,774.0
The smell in the theater caused the man to feel Like he was in a public urinal,The theater smelled like one would expect perhaps popcorn,The theater smelled bad.,1,1,X321,775.0
Carrying her instrument home after school was like Trying to carry a toddler,Her instrument was cumbersome,Her instrument was easy to carry,0,1,X322,776.0
Carrying her instrument home after school was like Throwing a baseball bat in your backpack.,Her instrument was cumbersome,Her instrument was easy to carry,1,1,X322,777.0
He spoke French about as well as a hamster,He did not speak French well,He spoke French very well,0,1,X323,780.0
He spoke French about as well as Emmanuel Macron,He did not speak French well,He spoke French very well,1,1,X323,781.0
Her routine was as good as the village idiot,Her routine was not good,Her routine was good,0,1,X324,782.0
Her routine was as good as Henny Yougman,Her routine was not good,Her routine was good,1,1,X324,783.0
The instrument was as easy to learn as astrophysics,The instrument was not easy to learn,The instrument was easy to learn,0,1,X325,784.0
The instrument was as easy to learn as a kazoo,The instrument was not easy to learn,The instrument was easy to learn,1,1,X325,785.0
The instrument sounds like strings from heaven,The instrument sounds amazing,the instrument sounds terrible,0,1,X326,786.0
The instrument sounds like clanging pans,The instrument sounds amazing,the instrument sounds terrible,1,1,X326,787.0
The classroom was as full as a hospital during a plague,The classroom was packed full of people,The classroom was pretty much empty,0,1,X327,788.0
The classroom was as full as a cops box of doughnuts,The classroom was packed full of people,The classroom was pretty much empty,1,1,X327,789.0
The team played like they had broken legs,The team played badly,The team played perfectly,0,1,X328,790.0
The team played like they could read each others minds,The team played badly,The team played perfectly,1,1,X328,791.0
The employer is a marshmallow,The employer is very relaxed.,The employer is very tough.,0,1,X329,792.0
The employer is peanut brittle,The employer is very relaxed.,The employer is very tough.,1,1,X329,793.0
The man's idea is as creative as a chocolate chip cookie,The man's idea is very unoriginal.,The man's idea is very creative.,0,1,X330,794.0
The man's idea is as creative as red velvet white chip cookies,The man's idea is very unoriginal.,The man's idea is very creative.,1,1,X330,795.0
The woman's contributions are as substantive as steak,The woman's contributions are substantive.,The woman's contributions are minimal.,0,1,X331,796.0
The woman's contributions are as substantive as a side salad,The woman's contributions are substantive.,The woman's contributions are minimal.,1,1,X331,797.0
The writer's use of language was A instrument of its own,The writer's use of language was unique and sharp,The writer's use of language was flat and unoriginal,0,1,X332,798.0
The writer's use of language was Dull as a butter knife,The writer's use of language was unique and sharp,The writer's use of language was flat and unoriginal,1,1,X332,799.0
The bread was Like the desert,The bread was dry,The bread was soft,0,1,X333,800.0
The bread was Like a sponge,The bread was dry,The bread was soft,1,1,X333,801.0
The water in the tub Was as a frozen lake,The water in the tub was way too cold,The water in the tub was boiling too hot,0,1,X334,802.0
The water in the tub As a cauldron,The water in the tub was way too cold,The water in the tub was boiling too hot,1,1,X334,803.0
That band is so 2022,That band is so modern.,That band is so outdated.,0,1,X335,804.0
That band is so 1900,That band is so modern.,That band is so outdated.,1,1,X335,805.0
He is the 1970s.,He is unfashionable.,He is fashionable.,0,1,X336,806.0
He is the 2020s.,He is unfashionable.,He is fashionable.,1,1,X336,807.0
the football player had the reflexes of a statue,The player was not skilled,The player was skilled,0,1,X337,810.0
the football player had the reflexes of a mousetrap,The player was not skilled,The player was skilled,1,1,X337,811.0
The tower had the support of a a toothpick,The tower was flimsy,The tower was sturdy,0,1,X338,812.0
The tower had the support of a a girdle,The tower was flimsy,The tower was sturdy,1,1,X338,813.0
The test was as complicated as buttering toast,The test was easy,The test was difficult,0,1,X339,814.0
The test was as complicated as blockchain,The test was easy,The test was difficult,1,1,X339,815.0
That kids were running as if there was a fire,The kids were in such a rush to get from point A to point B,The kids were running so fast,0,1,X340,816.0
That kids were running as fast as the speed of sound,The kids were in such a rush to get from point A to point B,The kids were running so fast,1,1,X340,817.0
That cannonball the man did in the pool seemed as if an asteroid hit the ocean,The man created a gigantic splash,the man created such a little splash,0,1,X341,818.0
That cannonball the man did in the pool seemed as a pebble hitting a puddle,The man created a gigantic splash,the man created such a little splash,1,1,X341,819.0
The test felt like a brick wall,The test was hard,the test was easy,0,1,X342,820.0
The test felt like a breeze,The test was hard,the test was easy,1,1,X342,821.0
The wave is a mini mart,The wave is small,The wave is large,0,1,X343,824.0
The wave is a super walmart,The wave is small,The wave is large,1,1,X343,825.0
Running this race was a bean dip,Running this race was simple,Running this race was complex,0,1,X344,826.0
Running this race was a 7 layer dip,Running this race was simple,Running this race was complex,1,1,X344,827.0
The plants were appetizers,The plants were uninteresting (small),These plants were complex (large),0,1,X345,828.0
The plants were the main course,The plants were uninteresting (small),These plants were complex (large),1,1,X345,829.0
The wave has the power of a wrecking ball.,The wave is strong.,The wave is weak.,0,1,X346,830.0
The wave has the power of a feather.,The wave is strong.,The wave is weak.,1,1,X346,831.0
Running is as enjoyable as a root canal.,Running is awful.,Running is fun.,0,1,X347,832.0
Running is as enjoyable as a day at the fair.,Running is awful.,Running is fun.,1,1,X347,833.0
Growing plants is as easy as 1-2-3.,Growing plants is easy.,Growing plants is hard.,0,1,X348,834.0
Growing plants is as easy as calculus.,Growing plants is easy.,Growing plants is hard.,1,1,X348,835.0
The exam schedule is as strict as a military leader,The exam schedule is very strict.,The exam schedule is very lenient.,0,1,X349,836.0
The exam schedule is as strict as a preschool teacher,The exam schedule is very strict.,The exam schedule is very lenient.,1,1,X349,837.0
The puzzle was as challenging to complete as a physics PhD,The puzzle was very difficult to complete.,The puzzle was very easy to complete.,0,1,X350,838.0
The puzzle was as challenging to complete as a knock-knock joke,The puzzle was very difficult to complete.,The puzzle was very easy to complete.,1,1,X350,839.0
The woman's statements are as official as a social security card,The woman's statements are very official.,The woman's statements are very unofficial.,0,1,X351,840.0
The woman's statements are as official as a contract written on a napkin,The woman's statements are very official.,The woman's statements are very unofficial.,1,1,X351,841.0
The wave climbed as high as An alp,The wave rose very high,The wave was minimal and subtle,0,1,X352,842.0
The wave climbed as high as A toddler,The wave rose very high,The wave was minimal and subtle,1,1,X352,843.0
The garden was a Haven of life,The garden was full of variety and diversity,The garden was barren,0,1,X353,844.0
The garden was a A wasteland,The garden was full of variety and diversity,The garden was barren,1,1,X353,845.0
The president's speech was Dynamite,The president's speech was exciting,The president's speech was underwhelming,0,1,X354,846.0
The president's speech was A wet blanket,The president's speech was exciting,The president's speech was underwhelming,1,1,X354,847.0
My kid's room was like looking at the damage of an F5 tornado,My kid's room was extremely messy,My kid's room was neat and tidy.,0,1,X355,848.0
My kid's room was like Marine barracks just before inspection.,My kid's room was extremely messy,My kid's room was neat and tidy.,1,1,X355,849.0
She had the look of someone that just scratched off a million dollar lottery ticket.,she had the look of grtitude and joy.,She had the look of sadness.,0,1,X356,850.0
She had the look of A woman that lost the family dog.,she had the look of grtitude and joy.,She had the look of sadness.,1,1,X356,851.0
Her singing voice was like fingernails scraping across a chalkboard.,Her singing voice was agonizing.,Her singing voice was beautiful.,0,1,X357,852.0
Her singing voice was like music at the entrance to heaven.,Her singing voice was agonizing.,Her singing voice was beautiful.,1,1,X357,853.0
Love is a thrill ride,Love is very exciting,Love is down to earth and chill,0,1,X358,854.0
Love is a fine wine,Love is very exciting,Love is down to earth and chill,1,1,X358,855.0
His mother was a shopaholic,His mother spends a lot,His mother tries to save as much as she can,0,1,X359,858.0
His mother was a penny pincher,His mother spends a lot,His mother tries to save as much as she can,1,1,X359,859.0
My body is as fit as an athlete,My body is fit,My body is not fit,0,1,X360,860.0
My body is as fit as a manatee,My body is fit,My body is not fit,1,1,X360,861.0
My goal is fruitfull like an apple grove,I am reaching my goal,I am not reaching my goal,0,1,X361,862.0
My goal is fruitfull like a dead tree,I am reaching my goal,I am not reaching my goal,1,1,X361,863.0
That bank branch is as honest as a saint,The bank branch is honest,The bank branch is dishonest,0,1,X362,864.0
That bank branch is as honest as a crook,The bank branch is honest,The bank branch is dishonest,1,1,X362,865.0
I have the face of a model,My face is attractive,My face is hideous,0,1,X363,866.0
I have the face of a monster,My face is attractive,My face is hideous,1,1,X363,867.0
That branch is as strong as metal,That branch is strong,That branch is weak,0,1,X364,868.0
That branch is as strong as string,That branch is strong,That branch is weak,1,1,X364,869.0
My new cologne smells like heaven,My new cologne smells great,My new cologne smells awful,0,1,X365,870.0
My new cologne smells like death,My new cologne smells great,My new cologne smells awful,1,1,X365,871.0
The wait for the train lasted as long as a line at the dmv,The wait for the train took a while.,The wait for the train was quick,0,1,X366,872.0
The wait for the train lasted as long as a sneeze,The wait for the train took a while.,The wait for the train was quick,1,1,X366,873.0
The fire was as hot as an active volcano,The fire was very hot,The fire was not warm,0,1,X367,874.0
The fire was as hot as a desert at night,The fire was very hot,The fire was not warm,1,1,X367,875.0
The movie was as sad as a stand up comedy show,The movie was happy,The movie was very sad,0,1,X368,876.0
The movie was as sad as the death of a pet,The movie was happy,The movie was very sad,1,1,X368,877.0
She had the body of a goat mixed with a cow,Her body was not pleasing to look at.,Her body was great to look at.,0,1,X369,878.0
She had the body of a Goddess,Her body was not pleasing to look at.,Her body was great to look at.,1,1,X369,879.0
He missed the goal by a 100 miles,He wildly missed the goal.,He only slightly missed the goal.,0,1,X370,880.0
He missed the goal by the length of a gnat,He wildly missed the goal.,He only slightly missed the goal.,1,1,X370,881.0
The branch was sharp like a knife,The branch was very sharp.,The branch was not sharp at all.,0,1,X371,882.0
The branch was sharp like a rubber eraser,The branch was very sharp.,The branch was not sharp at all.,1,1,X371,883.0
The body of the car was as sleek as The modern kitchen in a million dollar home,The car styling was modern,The car styling was old-fashioned,0,1,X372,884.0
The body of the car was as sleek as A 1950s pickup truck,The car styling was modern,The car styling was old-fashioned,1,1,X372,885.0
The women's financial goal reminded her accountant of People who eat ramen for a month in order to save extra money,The woman was willing to sacrifice to save money,The woman wasn't serious about saving money,0,1,X373,886.0
The women's financial goal reminded her accountant of People who only drink Starbucks coffee everyday.,The woman was willing to sacrifice to save money,The woman wasn't serious about saving money,1,1,X373,887.0
The branch that landed on his hood looked like The trunk of a 20-year-old oak,The branch was really big,The branch was really small,0,1,X374,888.0
The branch that landed on his hood looked like Maple tree seeds,The branch was really big,The branch was really small,1,1,X374,889.0
The goal was a sandbox,The goal was small,The goal was large,0,1,X375,894.0
The goal was the Sonoran Desert,The goal was small,The goal was large,1,1,X375,895.0
The bank's branch was a bonsai limb,The bank's branch was small,The bank's branch was large,0,1,X376,896.0
The bank's branch was an oak limb,The bank's branch was small,The bank's branch was large,1,1,X376,897.0
The honey was as well preserved as an undiscovered Egyptian mummy,The honey was well preserved,The honey wasn't preserved well,0,1,X377,898.0
The honey was as well preserved as a week old loaf of bread in a humid environment,The honey was well preserved,The honey wasn't preserved well,1,1,X377,899.0
The candy was the price of a 99 cent item on clearance,The candy was very cheap,The candy was expensive,0,1,X378,900.0
The candy was the price of a manmade private island,The candy was very cheap,The candy was expensive,1,1,X378,901.0
The country had the military power of Pepsi after their deal with the Soviet Union,The country had a lot of military power,The country had little military power,0,1,X379,902.0
The country had the military power of Germany following World War II,The country had a lot of military power,The country had little military power,1,1,X379,903.0
The razor is as sharp as a miniature samurai sword,The razor is sharp,The razor is dull,0,1,X380,904.0
The razor is as sharp as a butter knife,The razor is sharp,The razor is dull,1,1,X380,905.0
The window is as clear as a crystal,The window is clean,The window is dirty,0,1,X381,906.0
The window is as clear as swamp,The window is clean,The window is dirty,1,1,X381,907.0
The odds look as good as gold,The odds are in their favor,The odds are not in their favor,0,1,X382,908.0
The odds look as good as dirt,The odds are in their favor,The odds are not in their favor,1,1,X382,909.0
The razor was as sharp as A door knob,The razor is dull,The razor is very sharp,0,1,X383,910.0
The razor was as sharp as An instrument that cuts through wood like butter,The razor is dull,The razor is very sharp,1,1,X383,911.0
The window has the transparency of A glass full of muddy water,The window was opaque and difficult to see through,The window is very transparent and one is able to see through it easily,0,1,X384,912.0
The window has the transparency of A telescope in a state-of-the-art observatory,The window was opaque and difficult to see through,The window is very transparent and one is able to see through it easily,1,1,X384,913.0
The odds for winning the prize are like that of Having one lottery ticket among a billion,Winning the prize is almost impossible,Winning the prize is pretty much a sure thing,0,1,X385,914.0
The odds for winning the prize are like that of An almost sure thing like rain in April,Winning the prize is almost impossible,Winning the prize is pretty much a sure thing,1,1,X385,915.0
My car is looking like superman,My car is looking strong and attractive.,My car is looking basic and unassuming.,0,1,X386,916.0
My car is looking like Clark Kent,My car is looking strong and attractive.,My car is looking basic and unassuming.,1,1,X386,917.0
My social life is like a polar pop.,My social life is quite cool right now.,My social life is pretty hot right now.,0,1,X387,918.0
My social life is like jerk chicken.,My social life is quite cool right now.,My social life is pretty hot right now.,1,1,X387,919.0
Your driving is like beach waves.,Your driving is full of crashes.,Your driving shows great skill.,0,1,X388,920.0
Your driving is like a pro archer.,Your driving is full of crashes.,Your driving shows great skill.,1,1,X388,921.0
The wind was a howling banshee,The wind was fierce and ear-piercing,The wind was barely existent or audible,0,1,X389,922.0
The wind was a whisper,The wind was fierce and ear-piercing,The wind was barely existent or audible,1,1,X389,923.0
The ballerina performed as if on ice,The ballerina was gliding from on place to another with ease,The ballerina was incapable of performing as in encumbered by injury,0,1,X390,924.0
The ballerina performed as if on crutches,The ballerina was gliding from on place to another with ease,The ballerina was incapable of performing as in encumbered by injury,1,1,X390,925.0
The child at dinner was a pig,The child ate all food without a second thought,The child only nibbled at his plate of food without consuming a great deal,0,1,X391,926.0
The child at dinner was a squirrel,The child ate all food without a second thought,The child only nibbled at his plate of food without consuming a great deal,1,1,X391,927.0
He was angry as a kitten,He was not angry but friendly and cuddly,He was unmistakably angry,0,1,X392,928.0
He was angry as a fresh zit,He was not angry but friendly and cuddly,He was unmistakably angry,1,1,X392,929.0
This razor is sharp like broken glass,This razor is very sharp,"This razor is not sharp, rather dull",0,1,X393,930.0
This razor is sharp like a pillow,This razor is very sharp,"This razor is not sharp, rather dull",1,1,X393,931.0
The view from the window was as stunning as a Texas beauty queen,The view from the window was beautiful,The view from the window was unattractive,0,1,X394,932.0
The view from the window was as stunning as a 50-year-old cat lady,The view from the window was beautiful,The view from the window was unattractive,1,1,X394,933.0
The blade was as sharp as a ripe banana,The blade was not sharp,The blade was sharp,0,1,X395,934.0
The blade was as sharp as a Jeopardy winner,The blade was not sharp,The blade was sharp,1,1,X395,935.0
The odds were as good as the sun rising,The odds were good,The odds were not good,0,1,X396,936.0
The odds were as good as the sun not rising,The odds were good,The odds were not good,1,1,X396,937.0
The window was as open as an exhibitionist's fly,The window was open,The window was closed,0,1,X397,938.0
The window was as open as Donald Trump's wallet,The window was open,The window was closed,1,1,X397,939.0
The windows are as clean as the pope's conscience,The windows are sparkling clean,The windows are really dirty,0,1,X398,948.0
The windows are as clean as Jack the Ripper,The windows are sparkling clean,The windows are really dirty,1,1,X398,949.0
Those are the same odds as the chance of someone walking outside,The chances are very high,The chances are almost impossible,0,1,X399,950.0
Those are the same odds as the chance of the world exploding today,The chances are very high,The chances are almost impossible,1,1,X399,951.0
That gravy is about as thick as Donald Trumps ego,The gravy is really think,The gravy is really thin,0,1,X400,952.0
That gravy is about as thick as air on a mountaintop,The gravy is really think,The gravy is really thin,1,1,X400,953.0
The thrill ride was about as thrilling as space flight,The thrill ride was thrilling,The thrill ride was not thrilling,0,1,X401,954.0
The thrill ride was about as thrilling as math class,The thrill ride was thrilling,The thrill ride was not thrilling,1,1,X401,955.0
His idea was as logical as a math equation,His idea was logical,His idea was not logical,0,1,X402,956.0
His idea was as logical as a toddler's babbling,His idea was logical,His idea was not logical,1,1,X402,957.0
