startphrase,ending1,ending2,labels,valid,qid,index
The end of the movie was as unknown to the man as His unborn son's future career,The man had no idea how the movie would end,The movie was predictable,0,1,X1256,2833.0
The end of the movie was as unknown to the man as His lunch for work tomorrow,The man had no idea how the movie would end,The movie was predictable,1,1,X1256,2834.0
This mouthwash has the strength of Thor's hammer crushing his enemies,The mouthwash is really spicy and good at killing germs,The mouthwash doesn't work well at killing germs and isn't spicy,0,1,X1257,2835.0
This mouthwash has the strength of a bug trying to kill a car,The mouthwash is really spicy and good at killing germs,The mouthwash doesn't work well at killing germs and isn't spicy,1,1,X1257,2836.0
The bee sting pain rating was a dinosaur dying from getting its tail crushed,The bee sting was agonizing,The bee sting barely even hurt,0,1,X1258,2837.0
The bee sting pain rating was trying to kill an elephant by throwing bread at its face,The bee sting was agonizing,The bee sting barely even hurt,1,1,X1258,2838.0
The bedtime story had the fables to put an angry Sasquatch with insomnia to sleep,The bedtime story could put you to sleep easily,The bedtime story didn't help putting someone to sleep,0,1,X1259,2839.0
The bedtime story had the fables to keep a crazy wasp awake for days,The bedtime story could put you to sleep easily,The bedtime story didn't help putting someone to sleep,1,1,X1259,2840.0
The cicadas were as loud as a whisper,The cicadas were not loud,The cicadas were loud,0,1,X1260,2841.0
The cicadas were as loud as a banshee,The cicadas were not loud,The cicadas were loud,1,1,X1260,2842.0
The comet came as near as the dentures in your mouth,The comet came near,The comet did not come near,0,1,X1261,2843.0
The comet came as near as Alpha Centauri,The comet came near,The comet did not come near,1,1,X1261,2844.0
The formula was as well-known as the eleventh president of Zambia,The formula was not well-known,The formula was well-known,0,1,X1262,2845.0
The formula was as well-known as which way is up,The formula was not well-known,The formula was well-known,1,1,X1262,2846.0
The dress was as lovely as a summer walk,it was beautiful,it was ugly,0,1,X1263,2847.0
The dress was as lovely as a winter storm,it was beautiful,it was ugly,1,1,X1263,2848.0
The hospital was as clean as a school with no kids,it was neat,it was dirty,0,1,X1264,2849.0
The hospital was as clean as a bus full of homeless people,it was neat,it was dirty,1,1,X1264,2850.0
The seatbelt was as rusty as a ship that sat there for years,it was full of rust,it was like new,0,1,X1265,2851.0
The seatbelt was as rusty as a new tool set,it was full of rust,it was like new,1,1,X1265,2852.0
This car is as fast as a fox with its tail on fire.,The car is very fast,The car is very slow,0,1,X1266,2853.0
This car is as fast as a clogged toilet drains.,The car is very fast,The car is very slow,1,1,X1266,2854.0
The pepper is hot as my graphics card while crypto mining,The pepper is very hot,The pepper is mild,0,1,X1267,2855.0
The pepper is hot as my feet on a winter morning,The pepper is very hot,The pepper is mild,1,1,X1267,2856.0
My children have the attention span of a goldfish.,My children have a low attention span.,My children have a high attention span.,0,1,X1268,2857.0
My children have the attention span of the Queens Guard,My children have a low attention span.,My children have a high attention span.,1,1,X1268,2858.0
He has the warmth of a snowball,He is cold,He is warm,0,1,X1269,2859.0
He has the warmth of a raging fire,He is cold,He is warm,1,1,X1269,2860.0
He is as flexible as a snail,He is not agile,He is agile,0,1,X1270,2861.0
He is as flexible as a monkey,He is not agile,He is agile,1,1,X1270,2862.0
It is as funny as a wet noodle,It is not amusing,It is amusing,0,1,X1271,2863.0
It is as funny as slipping on a banana peel,It is not amusing,It is amusing,1,1,X1271,2864.0
This conversation flowed like A smooth cascade,The conversation went well,The conversation was heated,0,1,X1272,2865.0
This conversation flowed like A vicious tide,The conversation went well,The conversation was heated,1,1,X1272,2866.0
After being fixed the chair Is as a monolith again,The chair is as good as new or better,The chair is brittle,0,1,X1273,2867.0
After being fixed the chair Has been reduced to a snowflake,The chair is as good as new or better,The chair is brittle,1,1,X1273,2868.0
These shoes are a sponge,The shoes soak up a lot of water,The shoes are airtight as a plane,0,1,X1274,2869.0
These shoes are like a plane,The shoes soak up a lot of water,The shoes are airtight as a plane,1,1,X1274,2870.0
This conversation has the interest of watching wallpaper dry.,This conversation is boring,This conversation is really interesting and engaging,0,1,X1275,2873.0
This conversation has the interest of a thousand hearts landing in my arms,This conversation is boring,This conversation is really interesting and engaging,1,1,X1275,2874.0
Those flowers have the beauty of a million unicorns with rainbows in every direction,Those flowers are really gorgeous,Those flowers are really ugly,0,1,X1276,2875.0
Those flowers have the beauty of a dying hyena,Those flowers are really gorgeous,Those flowers are really ugly,1,1,X1276,2876.0
This drink has the flavor of a million sugar cubes stroking my brain,This drink tastes good,This drink tastes horrible,0,1,X1277,2877.0
This drink has the flavor of a cheese grater cutting my tongue,This drink tastes good,This drink tastes horrible,1,1,X1277,2878.0
That was about as cold as dry ice,"That was really, very cold",That was not at all cold,0,1,X1278,2879.0
That was about as cold as a fireball,"That was really, very cold",That was not at all cold,1,1,X1278,2880.0
That sounds as good as a blown speaker,That sounds aweful,That sounds great,0,1,X1279,2881.0
That sounds as good as ice cream on a hot day,That sounds aweful,That sounds great,1,1,X1279,2882.0
The crowd has as much energy as a 3 year old,The crowd is very energetic,The crowd does not have much energy at all,0,1,X1280,2883.0
The crowd has as much energy as an old man,The crowd is very energetic,The crowd does not have much energy at all,1,1,X1280,2884.0
The woman has the personality of a bottle of shaken Coca Cola,The woman has a very bold personality.,The woman has a very plain personality.,0,1,X1281,2885.0
The woman has the personality of a glass of milk,The woman has a very bold personality.,The woman has a very plain personality.,1,1,X1281,2886.0
The essay instructions are as straightforward as Apple's terms and conditions,The essay instructions are unclear.,The essay instructions are straightforward.,0,1,X1282,2887.0
The essay instructions are as straightforward as a child's book,The essay instructions are unclear.,The essay instructions are straightforward.,1,1,X1282,2888.0
The agreement between the friends is as formal as a merger agreement,The agreement between the friends is very formal.,The agreement between the friends is very informal.,0,1,X1283,2889.0
The agreement between the friends is as formal as a scribbled out Post-it note,The agreement between the friends is very formal.,The agreement between the friends is very informal.,1,1,X1283,2890.0
Conversation was as enthralling as Watching a boxing match,The conversation was very engrossing,Conversation was boring people to sleep,0,1,X1284,2891.0
Conversation was as enthralling as Watching a PTA debate,The conversation was very engrossing,Conversation was boring people to sleep,1,1,X1284,2892.0
The new flavored olive oil made her think of Being in Tuscany,The olive oil was very authentic,The olive oil seemed counterfeit,0,1,X1285,2893.0
The new flavored olive oil made her think of Being in New Jersey,The olive oil was very authentic,The olive oil seemed counterfeit,1,1,X1285,2894.0
Being late to the meeting made the woman feel like Being on stage performing,She felt like she was the center of attention,She felt like she was in trouble,0,1,X1286,2895.0
Being late to the meeting made the woman feel like Being sent to the principal's office,She felt like she was the center of attention,She felt like she was in trouble,1,1,X1286,2896.0
The concert was as loud as a gaudy t-shirt design.,The concert was very loud.,The concert was not very loud.,0,1,X1287,2897.0
The concert was as loud as insulating foam.,The concert was very loud.,The concert was not very loud.,1,1,X1287,2898.0
The pillow was as soft as a rich pacifist.,The pillow was very soft.,The pillow wasn't soft.,0,1,X1288,2899.0
The pillow was as soft as a hardened soldier.,The pillow was very soft.,The pillow wasn't soft.,1,1,X1288,2900.0
The rope was as long as The Lord of The Rings movie trilogy.,The rope was very long.,The rope wasn't very long.,0,1,X1289,2901.0
The rope was as long as a youtube advertisement.,The rope was very long.,The rope wasn't very long.,1,1,X1289,2902.0
That turkey has the texture of a tire,The turkey is very tough to eat and chew.,The turkey is easy to chew and eat.,0,1,X1290,2905.0
That turkey has the texture of a butter,The turkey is very tough to eat and chew.,The turkey is easy to chew and eat.,1,1,X1290,2906.0
The street has the friendliness of a rabid squirrel.,The street is very unfriendly.,The street is very friendly.,0,1,X1291,2909.0
The street has the friendliness of Mister Rogers.,The street is very unfriendly.,The street is very friendly.,1,1,X1291,2910.0
The baby has the balance of a trapeze artist.,The baby is very balanced.,The baby is very unbalanced.,0,1,X1292,2911.0
The baby has the balance of a drunk.,The baby is very balanced.,The baby is very unbalanced.,1,1,X1292,2912.0
My teeth have the integrity of carbon steel.,My teeth are very strong.,My teeth lack integrity.,0,1,X1293,2913.0
My teeth have the integrity of used car dealer.,My teeth are very strong.,My teeth lack integrity.,1,1,X1293,2914.0
The music was as soothing as A warm hug.,The music was greatly soothing.,The music was loud and disturbing.,0,1,X1294,2915.0
The music was as soothing as A air raid siren.,The music was greatly soothing.,The music was loud and disturbing.,1,1,X1294,2916.0
The book was as interesting as A solid white room.,The book is bland and boring.,The book is interesting.,0,1,X1295,2917.0
The book was as interesting as A newly found treasure chest.,The book is bland and boring.,The book is interesting.,1,1,X1295,2918.0
The shirt was as pretty as A plain blue tarp.,The shirt was not pretty at all.,The shirt was beautiful.,0,1,X1296,2919.0
The shirt was as pretty as A field of blooming tulips.,The shirt was not pretty at all.,The shirt was beautiful.,1,1,X1296,2920.0
This trip has been Worst than my dentist appointment,This trip has been terrible,The trip has been amazing,0,1,X1297,2925.0
This trip has been Like snow on christmas,This trip has been terrible,The trip has been amazing,1,1,X1297,2926.0
The display was as clear as crystal,The display was clear,The display was distorted,0,1,X1298,2927.0
The display was as clear as shattered crystal,The display was clear,The display was distorted,1,1,X1298,2928.0
The pie was as sweet as sugar,The pie was sweet,The pie was not sweet,0,1,X1299,2929.0
The pie was as sweet as vinegar,The pie was sweet,The pie was not sweet,1,1,X1299,2930.0
I'm as threatening as a monster,I'm threatening,I'm nonthreatening,0,1,X1300,2931.0
I'm as threatening as a milkman,I'm threatening,I'm nonthreatening,1,1,X1300,2932.0
The display was as clear as a cataract,The display was not clear,The display was clear,0,1,X1301,2935.0
The display was as clear as crystal,The display was not clear,The display was clear,1,1,X1301,2936.0
The tub finish looked like a bad case of acne,The tub finish looked  bad,The tub finish looked nice,0,1,X1302,2937.0
The tub finish looked like polished glass,The tub finish looked  bad,The tub finish looked nice,1,1,X1302,2938.0
The illusion was as good as a 12-pixel GIF,The illusion was bad,The illusion was good,0,1,X1303,2939.0
The illusion was as good as a UHD TV,The illusion was bad,The illusion was good,1,1,X1303,2940.0
The display had all the detail of The Birth of Venus,The display had a lot of detail,The display was not detailed,0,1,X1304,2941.0
The display had all the detail of a child's crayon drawing,The display had a lot of detail,The display was not detailed,1,1,X1304,2942.0
The computer was as high-tech as Laserdisc in 1978,The computer was high-tech,The computer was outdated,0,1,X1305,2943.0
The computer was as high-tech as Laserdisc in 1998,The computer was high-tech,The computer was outdated,1,1,X1305,2944.0
The new video game is as fun  as going to Disney World,The new video game is so much fun.,The new video game is highly worth avoiding.,0,1,X1306,2947.0
The new video game is as fun  as digging ditches in the hot sun,The new video game is so much fun.,The new video game is highly worth avoiding.,1,1,X1306,2948.0
The television show is as interesting as a cucumber,The television show is boring.,The television show is exciting.,0,1,X1307,2949.0
The television show is as interesting as a lost treasure,The television show is boring.,The television show is exciting.,1,1,X1307,2950.0
The new iPad is as good as a stick,The new iPad stinks.,The new iPad is worth every penny.,0,1,X1308,2951.0
The new iPad is as good as gold,The new iPad stinks.,The new iPad is worth every penny.,1,1,X1308,2952.0
Her head has the capacity of a thimble,she is not capable of much intelligence,"she is capable of deep, critical thinking",0,1,X1309,2953.0
Her head has the capacity of a universe,she is not capable of much intelligence,"she is capable of deep, critical thinking",1,1,X1309,2954.0
The jacket has the appeal of a swarm of bees,The jacket is unappealing.,The jacket is very appealing.,0,1,X1310,2955.0
The jacket has the appeal of a cozy winter's night,The jacket is unappealing.,The jacket is very appealing.,1,1,X1310,2956.0
The computer is as fast as a sick snail,The computer is slow.,The computer is fast.,0,1,X1311,2957.0
The computer is as fast as a hungry cheetah,The computer is slow.,The computer is fast.,1,1,X1311,2958.0
His head was as smooth as a pebble,His head was smooth,His head was lumpy,0,1,X1312,2959.0
His head was as smooth as porridge,His head was smooth,His head was lumpy,1,1,X1312,2960.0
The painting was as permanent as the wind,The painting was temporary,The painting was long lasting,0,1,X1313,2961.0
The painting was as permanent as granite,The painting was temporary,The painting was long lasting,1,1,X1313,2962.0
She had the grace of a ballerina,She was graceful,She was clumsy,0,1,X1314,2963.0
She had the grace of a toad,She was graceful,She was clumsy,1,1,X1314,2964.0
The hair color was as permanent as a passing thought,The hair color was not permanent,The hair color was permanent,0,1,X1315,2965.0
The hair color was as permanent as a marble monument,The hair color was not permanent,The hair color was permanent,1,1,X1315,2966.0
The rules were as complicated as one plus one is two,The rules were not complicated,The rules were complicated,0,1,X1316,2967.0
The rules were as complicated as a Rubik cube,The rules were not complicated,The rules were complicated,1,1,X1316,2968.0
Her head was as big as a beach ball,Her head was big,Her head was not big,0,1,X1317,2969.0
Her head was as big as a hamster's,Her head was big,Her head was not big,1,1,X1317,2970.0
Her boyfriend was a romantic as a John Keats poem.,Her boyfriend was sincere and romantic.,Her boyfriend was cynical and not romantic.,0,1,X1318,2971.0
Her boyfriend was a romantic as Schopenhauer.,Her boyfriend was sincere and romantic.,Her boyfriend was cynical and not romantic.,1,1,X1318,2972.0
The coach's behavior was as stable as Francium.,The coach's behavior was unsteady.,The coach's behavior was steady and stable.,0,1,X1319,2973.0
The coach's behavior was as stable as a noble gas.,The coach's behavior was unsteady.,The coach's behavior was steady and stable.,1,1,X1319,2974.0
His approach to the group was as gracious as the Dali Lama.,His approach was open-hearted and full of grace.,His approach was closed off and legalistic.,0,1,X1320,2975.0
His approach to the group was as gracious as a religious cult leader.,His approach was open-hearted and full of grace.,His approach was closed off and legalistic.,1,1,X1320,2976.0
The color of her future son's hair was a certain as The color of her husband's hair,She was fairly sure she knew what color her son's hair would be,She had no clue what color the son's hair would be,0,1,X1321,2979.0
The color of her future son's hair was a certain as The color of the man's hair she had yet to meet to have the kid with,She was fairly sure she knew what color her son's hair would be,She had no clue what color the son's hair would be,1,1,X1321,2980.0
The marker stain on her shirt was as permanent as The tattoo on her ankle,The mark was permanent,The mark could be wiped off,0,1,X1322,2981.0
The marker stain on her shirt was as permanent as The scuff mark on her car door,The mark was permanent,The mark could be wiped off,1,1,X1322,2982.0
The man bet as much on the game as He paid for his mortgage,The man was a heavy better,The man only dabbled in betting,0,1,X1323,2983.0
The man bet as much on the game as He paid for his morning cup of coffee,The man was a heavy better,The man only dabbled in betting,1,1,X1323,2984.0
This place is as permanent as the Earth itself,This place will last forever,This place will not last long,0,1,X1324,2985.0
This place is as permanent as a sand castle,This place will last forever,This place will not last long,1,1,X1324,2986.0
My head's as handsome as a Renaissance painting,My head's handsome,My head's ugly,0,1,X1325,2989.0
My head's as handsome as a monster mask,My head's handsome,My head's ugly,1,1,X1325,2990.0
That runner is a cheetah,That runner is fast,That runner is slow,0,1,X1326,2991.0
That runner is a tortoise,That runner is fast,That runner is slow,1,1,X1326,2992.0
That sweater is a puppy dog,That sweater is soft and cuddly.,That sweater is rough and itchy.,0,1,X1327,2995.0
That sweater is a haystack,That sweater is soft and cuddly.,That sweater is rough and itchy.,1,1,X1327,2996.0
the dinner was as tasty as mush,the dinner was tasteless,the dinner was delicious,0,1,X1328,2997.0
the dinner was as tasty as mama's home cooking,the dinner was tasteless,the dinner was delicious,1,1,X1328,2998.0
the babysitter was as mature as her charge,the sitter was not competent,the sitter was competent,0,1,X1329,2999.0
the babysitter was as mature as Mary Poppins,the sitter was not competent,the sitter was competent,1,1,X1329,3000.0
the tv star was as personable as a cardboard cutout,the tv star had no personality,the tv star was charming,0,1,X1330,3001.0
the tv star was as personable as a long lost friend,the tv star had no personality,the tv star was charming,1,1,X1330,3002.0
She's a kid's game.,She's manipulatable.,She's unmanipulable.,0,1,X1331,3003.0
She's a round of Jeopardy.,She's manipulatable.,She's unmanipulable.,1,1,X1331,3004.0
He is a pile of smashed pottery.,He's weak.,He's strong.,0,1,X1332,3005.0
He is a pile of bricks.,He's weak.,He's strong.,1,1,X1332,3006.0
The mansion is a rotting whale.,The mansion is dilapidated.,The mansion is well-maintained.,0,1,X1333,3007.0
The mansion is a lion's den.,The mansion is dilapidated.,The mansion is well-maintained.,1,1,X1333,3008.0
The door was closed as tight as a drumhead,The door was closed tighly,The door was not closed tightly,0,1,X1334,3009.0
The door was closed as tight as a refrigerator without a door,The door was closed tighly,The door was not closed tightly,1,1,X1334,3010.0
The plot had the structure of demolished building,The plot had no structure,The plot had great structure,0,1,X1335,3011.0
The plot had the structure of a Manolo Blahnik dress pump,The plot had no structure,The plot had great structure,1,1,X1335,3012.0
He had the morality of a pickpocket,He had no morality,He had strict morality,0,1,X1336,3013.0
He had the morality of the Bishop of Canterbury,He had no morality,He had strict morality,1,1,X1336,3014.0
The log was a humpback whale,the log was large,the log was small,0,1,X1337,3021.0
The log was a betta fish,the log was large,the log was small,1,1,X1337,3022.0
The nachos were a Fort Knox,the nachos were big and full,the nachos were small and measly,0,1,X1338,3023.0
The nachos were an empty shack,the nachos were big and full,the nachos were small and measly,1,1,X1338,3024.0
The star had the largeness of a galaxy,the star was big,the star was small,0,1,X1339,3025.0
The star had the largeness of a pebble,the star was big,the star was small,1,1,X1339,3026.0
He was smart like a teacher.,He was very smart.,He wasn't very smart at all.,0,1,X1340,3032.0
He was smart like a dropout.,He was very smart.,He wasn't very smart at all.,1,1,X1340,3033.0
He was as honest as a lawyer.,He wasn't very honest.,He was very honest.,0,1,X1341,3034.0
He was as honest as a preacher.,He wasn't very honest.,He was very honest.,1,1,X1341,3035.0
Her eyes were as dark as black olives,her eyes were deep and black,her eyes were light,0,1,X1342,3036.0
Her eyes were as dark as a midday sky,her eyes were deep and black,her eyes were light,1,1,X1342,3037.0
The dog was as shaggy as Howard Stern's hair,The dog was hairy and unkempt,the dog was trimmed and neat,0,1,X1343,3038.0
The dog was as shaggy as a buzz cut,The dog was hairy and unkempt,the dog was trimmed and neat,1,1,X1343,3039.0
His nails were as sharp as needles,his nails are sharp and pointed,his nails are smooth and rounded,0,1,X1344,3040.0
His nails were as sharp as a spoon,his nails are sharp and pointed,his nails are smooth and rounded,1,1,X1344,3041.0
He has the morals of a saint,He has strong morals,He has no morals,0,1,X1345,3042.0
He has the morals of a devil,He has strong morals,He has no morals,1,1,X1345,3043.0
The structure was as sturdy as a house of cards,The structure was flimsy,The structure was solid,0,1,X1346,3044.0
The structure was as sturdy as a mountain,The structure was flimsy,The structure was solid,1,1,X1346,3045.0
He runs at the pace of A cheetah,He is a very fast runner,He runs very slowly,0,1,X1347,3046.0
He runs at the pace of A snail,He is a very fast runner,He runs very slowly,1,1,X1347,3047.0
Our relationship is as tight as a wetsuit,Our relationship is solid,Our relationship is questionable,0,1,X1348,3048.0
Our relationship is as tight as a drug dealers morals,Our relationship is solid,Our relationship is questionable,1,1,X1348,3049.0
We stopped at the light as gracefully as a lame turkey,We stopped roughly,We stopped smoothly,0,1,X1349,3052.0
We stopped at the light as gracefully as O.J.s lawyer,We stopped roughly,We stopped smoothly,1,1,X1349,3053.0
That's as safe as tying yourself to a raging bull,It's not safe at all,It's very low risk,0,1,X1350,3054.0
That's as safe as saving your money,It's not safe at all,It's very low risk,1,1,X1350,3055.0
That's as intimidating as a month old hamster,It's not scary at all,It's very scary.,0,1,X1351,3056.0
That's as intimidating as a hostile bear,It's not scary at all,It's very scary.,1,1,X1351,3057.0
They're as isolated as a game of hide and seek,They're completely divided,They're all together.,0,1,X1352,3058.0
They're as isolated as the Superbowl stands,They're completely divided,They're all together.,1,1,X1352,3059.0
This class subject matter is as exciting as a field trip to an abandoned graveyard.,This class subject matter is not exciting.,This class subject matter is very exciting.,0,1,X1353,3060.0
This class subject matter is as exciting as just discovering you were actually born with genie powers.,This class subject matter is not exciting.,This class subject matter is very exciting.,1,1,X1353,3061.0
This exotic dancer has the grace of a crippled lumberjack.,This exotic dancer has no grace.,This exotic dancer has a lot of grace.,0,1,X1354,3062.0
This exotic dancer has the grace of an exquisitely-trained ballerina.,This exotic dancer has no grace.,This exotic dancer has a lot of grace.,1,1,X1354,3063.0
The librarian had the charm of a sex-starved tarantula.,The librarian had no charm.,The librarian had charming qualities.,0,1,X1355,3064.0
The librarian had the charm of your most understanding confidante.,The librarian had no charm.,The librarian had charming qualities.,1,1,X1355,3065.0
They were as close as Trump and Biden,They were not close,They were close,0,1,X1356,3066.0
They were as close as an apple and its stem,They were not close,They were close,1,1,X1356,3067.0
Their house looked like the town dump,Their house looked bad,Their house looked good,0,1,X1357,3068.0
Their house looked like Buckingham Palace,Their house looked bad,Their house looked good,1,1,X1357,3069.0
She was as unique as a grain of sand,She was not unique,She was unique,0,1,X1358,3070.0
She was as unique as each snowflake,She was not unique,She was unique,1,1,X1358,3071.0
The couple's relationship was a boat on a stormy sea,The couple argued a lot,The couple argued infrequently,0,1,X1359,3072.0
The couple's relationship was a boat on a placid sea,The couple argued a lot,The couple argued infrequently,1,1,X1359,3073.0
The spices in the sauce were a gentle harmony,The sauce was well flavored.,The sauce tasted bad.,0,1,X1360,3074.0
The spices in the sauce were a cacophony,The sauce was well flavored.,The sauce tasted bad.,1,1,X1360,3075.0
The mattress was like a bag of sticks,The mattress was uncomfortable,The mattress was soft,0,1,X1361,3076.0
The mattress was like a marshmallow,The mattress was uncomfortable,The mattress was soft,1,1,X1361,3077.0
My last relationship Lasted an eternity,Was too long,Was too short,0,1,X1362,3078.0
My last relationship Was 5 minutes long.,Was too long,Was too short,1,1,X1362,3079.0
My life has been Like fresh cookies out the oven,My life is amazing,My life is terrible,0,1,X1363,3080.0
